videoId,parentId,commentId,isReply,authorDisplayName,text,likeCount,publishedAt,updatedAt,authorChannelId
PYz0CvEukvE,,Ugz9SxGqeERgsxuggVt4AaABAg,False,@お湯割りじじい,今期の演説は全部きいてるけど今回のは本当に素晴らしい、名演説。,12,2025-07-08T11:08:06Z,2025-07-08T11:08:06Z,UCbk6CCYa_9buUozK7JtrqUQ
PYz0CvEukvE,,UgwEKJLkIW-R-maw07p4AaABAg,False,@boost-rw2jj,声が枯れてきたな,2,2025-07-08T11:07:06Z,2025-07-08T11:07:06Z,UChh1FNEbfX1S0LI5HMOPKnA
PYz0CvEukvE,,UgxNb0RTSGxL0AxreRF4AaABAg,False,@yohei4351,めっちゃポジティブで好き。,9,2025-07-08T11:06:35Z,2025-07-08T11:06:35Z,UCw4lVHhSdsldg8mjJHeWy5A
PYz0CvEukvE,,UgyVO2ypM9p55To-SP54AaABAg,False,@クロ子-k2y,今回の選挙の前は良くわからい政党で毛嫌いしてました。でも知れば知るほど最高じゃないですか！このテーマ曲も泣けま🎤,10,2025-07-08T11:04:28Z,2025-07-08T11:04:28Z,UCEXe9Gt1q6POznll96VoGhQ
PYz0CvEukvE,,UgwL4O6yclR9LdeOheF4AaABAg,False,@田舎ばあば,"青森市民です。
何年も選挙なんて誰が議員なっても世の中大して変わらないとずーと投票に行ったこと無かったけど今回ばかりはもう米問題諸々腹の立つ事ばかり！家族４人で参政党一択で必ず選挙に行く事にしました。神谷代表頑張って下さいね。住みやすい日本にして下さい。お願いします。",97,2025-07-08T11:04:16Z,2025-07-08T11:04:16Z,UC5LrbuSQvB9nkkdgPZPUX0w
PYz0CvEukvE,,UgwIyIJ5GUgIdhuoqmV4AaABAg,False,@酋長J,加藤つとむさん、いい声しているね。自衛隊時代にもまれたのかな。,13,2025-07-08T11:04:13Z,2025-07-08T11:04:13Z,UCSB50G_GuMZ-5j-ScIZzZhQ
PYz0CvEukvE,,Ugy0CPvrXZHSxC1cz0l4AaABAg,False,@まるとと-q1g,お恥ずかしながら政治や選挙にあまり興味がありませんでした、、、ですが、今回参政党を知り心を動かされました！！私も日本を守りたい、選挙に行き、人に伝え自分にできる事から始めています！我が子の未来、自分たちの未来を守る為に参政党と一緒に戦います！！,9,2025-07-08T11:02:20Z,2025-07-08T11:02:20Z,UCHmv-xg6t_hp7PcUTEX7RJA
PYz0CvEukvE,,UgyyOCO9v3NZGcd-4n14AaABAg,False,@maruta-m4n,"青森までお疲れ様です😊
参政党に投票しますし、実家や嫁にも参政党ススメてます！",26,2025-07-08T11:01:30Z,2025-07-08T11:01:30Z,UCuOgxTFT1tjHj2vybTiDTrg
PYz0CvEukvE,,Ugw4d3p6CzdGkRaRZup4AaABAg,False,@RestInEvolutionJapan,地元を見直して自信を持つ！神谷さんに激飛ばしていただきました。ありがとうございます🙏🩷👍🏻,9,2025-07-08T11:00:25Z,2025-07-08T11:00:25Z,UCnhJBmX8WcJh-0JwvsnsIXw
PYz0CvEukvE,,UgzqL3P7zZlsFGzin2B4AaABAg,False,@zatunen-t6v,今、ユーチューブ高橋洋一Channelを見ていました。高橋氏が神谷代表の国防意識が幼稚園レベルと言っていました。アジア版nato・中国と仲良く・ドローンで防衛等を言ってるレベルの低い参政党とも…。流石に、私も本当の話なのか?とコメントをしました。大変影響力のある人物なので、是非とも神谷氏の反論を期待しています。,1,2025-07-08T10:58:44Z,2025-07-08T10:58:44Z,UC97CXSpFWWlWNRrcGdNamew
PYz0CvEukvE,,UgxtJepgzHC0KgISgf94AaABAg,False,@イチゴ-y8t,"神谷さんの全国行脚を毎日、ウオッチして見てます‼️
どの候補者も皆んな応援してます📣
皆んなで､元気玉を参政党に集められたら日本は変わると‼️祈って信じてます。
一緒に頑張りましょう‼️",15,2025-07-08T10:56:05Z,2025-07-08T10:56:05Z,UCCHTXNNCeSdRzAqY9t259Vg
PYz0CvEukvE,,Ugz705R7aJZbxMUz6hF4AaABAg,False,@以心伝心-p2m,"諦めない氣持ち
大義は日本の国益の為に
青森県は参政党と共に歩む！
希望に満ちた無限の可能性に乗ったー🟠🤩🔥✊",9,2025-07-08T10:55:44Z,2025-07-08T10:55:44Z,UCkhSAtwzyrlrr0q2gVZA0tw
PYz0CvEukvE,,UgwVlnsBIxXfc1Qr5RB4AaABAg,False,@ミスタ-h5s,仕事が休みなら　八戸市から駆けつけたかったです😢悔しい,13,2025-07-08T10:55:22Z,2025-07-08T10:55:22Z,UC3rc4NX0wcObEhbvJy7VIIQ
PYz0CvEukvE,,UgylbyaGujD4yTsbcLt4AaABAg,False,@ようこりん-h5d,加藤さんのちょっと訛りのある暖かい、でも実は熱いメッセージ、涙が出てきました。東京から応援しています！！,15,2025-07-08T10:55:16Z,2025-07-08T10:55:16Z,UCS3ECve3SG83LAfxB7Y8MIQ
PYz0CvEukvE,,Ugydj2cMMntCzB6P73d4AaABAg,False,@しのぶ井上-q9g,"参政党が国を変えたら歴史の教科書に載るぐらいすごい事だと思います。　生きてる間にこの奇跡を見てみたいです。
参政党応援してます。",157,2025-07-08T10:54:34Z,2025-07-08T10:54:34Z,UCiE0mSDFGDU3gs9bAbBCnFg
PYz0CvEukvE,,UgwZiLhA_qB3ZhC5YYB4AaABAg,False,@あ-y1w,"青森県民です。
絶対演説参加したかったです。
行けませんでしたが、参政党応援します。",25,2025-07-08T10:54:18Z,2025-07-08T10:54:18Z,UCvSfKZRve0cixpBIFllZl3w
PYz0CvEukvE,,UgzfxUW-i85kHzvOEAp4AaABAg,False,@Drss-md7po,立ち上がりましょう。神谷さんの為じゃなく国民皆の為に❗️,9,2025-07-08T10:52:38Z,2025-07-08T10:52:38Z,UClO72xQt0gsw7wtD_JiLdjg
PYz0CvEukvE,,UgzEqD1UVc3kJi6qs3B4AaABAg,False,@KA-yw7tb,"神谷さんは叩けば叩かれるぼど強く熱くなる。　
今日一番泣けました😢",10,2025-07-08T10:50:41Z,2025-07-08T10:51:18Z,UC2RlRPHnzZbFOBe6CktPjnA
PYz0CvEukvE,,Ugz9eIjONI-mhtyJb-x4AaABAg,False,@oichichan,青森県民です。選挙期間中必死で県内各地走り回ってアピールして頑張ってください。ネットしないジジババからの認知が低すぎる。絶対に加藤さんに当選してほしい。,111,2025-07-08T10:50:14Z,2025-07-08T10:50:14Z,UCwxDwvcJFOIr_qlYBPisGQQ
PYz0CvEukvE,,Ugyjl9kq_GJZDiwg80Z4AaABAg,False,@釣天狗-g5p,すごい演説🎤👍だ他の党は批判ばかりだ、やっぱり参政党だ‼️,47,2025-07-08T10:48:59Z,2025-07-08T10:48:59Z,UCZspuQBqkBlZsDnvJNb-i_Q
PYz0CvEukvE,,UgwtEcAaCSJBN74DnEZ4AaABAg,False,@スロかあ,"青森県民の方、素晴らしい方が立候補してくれましたね🎉
応援しております。

ある利権団体の中で、選挙の押さえ付けが起きてますね。
内部告発されてる投稿がありました。

負けてられません。
国民を守る
日本国を守るために頑張って選挙に行きましょうね🎉",15,2025-07-08T10:48:41Z,2025-07-08T10:48:41Z,UCAb0_pmC3hMo4SXJ9j0_0VA
PYz0CvEukvE,,UgyEoYkchr5Mh40o-jt4AaABAg,False,@クロ吉-z5k,神谷君、君が歴史の勉強した方がいいよ！,0,2025-07-08T10:48:20Z,2025-07-08T10:48:20Z,UCPbR8MbPKx3ISarYM9SGGZw
,UgyEoYkchr5Mh40o-jt4AaABAg,UgyEoYkchr5Mh40o-jt4AaABAg.AKJWwB79HjAAKMFNjuZ6_T,True,@niguchi2559,どこら辺がですか？,0,2025-07-09T12:12:40Z,2025-07-09T12:12:40Z,UCZRoDraaXso1uoHfdpvjIRA
,UgyEoYkchr5Mh40o-jt4AaABAg,UgyEoYkchr5Mh40o-jt4AaABAg.AKJWwB79HjAAKMUTuAGRRL,True,@gross-e3j,"教師をやってた人なので貴方より詳しいのでは？
間違った歴史認識と言うならば何処が間違ってるのか指摘して貰えますか?",0,2025-07-09T14:24:35Z,2025-07-09T14:24:35Z,UCpSCI7yjdz4jN755hN-aofQ
PYz0CvEukvE,,UgzPq5ubQrmy_ZmgBtd4AaABAg,False,@marumimaruyama5711,私のふるさと青森県の、みさんがしあわせになりますように、参政党に応援お願い、致します、山梨県から、応援しています🎉,142,2025-07-08T10:46:52Z,2025-07-08T10:46:52Z,UCMLbeL6OJilPcHTgtpXim4g
PYz0CvEukvE,,UgwJrr4p73ob1OzWLN14AaABAg,False,@hidebooya3694,配信ありがとう😂,7,2025-07-08T10:46:39Z,2025-07-08T10:46:39Z,UCpBf2t55UVrUD4skPbOKa4w
PYz0CvEukvE,,UgzxnOlqx61hneh4OZt4AaABAg,False,@miyaco.m,結党から一度もブレず参政党一択。3人の息子達家族ももちろん参政党一択です神谷氐ツラ構えがちがいます。71歳,24,2025-07-08T10:46:05Z,2025-07-08T10:46:05Z,UCp_sNCaL28JBSfsRegefDHA
PYz0CvEukvE,,UgwtbV7mbuarSZIPzMJ4AaABAg,False,@Nbggcvhhhh,"参政党が強くなれば、立憲は自民と連立することを恐れると思います。
なぜなら、自民についた維新のように没落したくないからです。
みんな選挙に行きましょう、連立されて消費税を17％にさせてはいけません。",68,2025-07-08T10:45:04Z,2025-07-08T10:45:04Z,UCCxpf9heijQIHgran2Vew_w
PYz0CvEukvE,,UgyEeVXEwVutx5uTzlV4AaABAg,False,@user-to6si7ws2n,初めて両親に選挙でここに入れ欲しいって頼んだよ。難しいかなと思ったけど、ありがたいことに子供の話は聞いてくれた。少しですが参政党票増えました🙌,229,2025-07-08T10:43:08Z,2025-07-08T10:43:08Z,UCfq-v9zpbC6A5VWrSczBkFw
,UgyEeVXEwVutx5uTzlV4AaABAg,UgyEeVXEwVutx5uTzlV4AaABAg.AKJWKzOwV2BAKJYm92rByi,True,@ずーたむ,"普通の価値観を持った子供に育ったと親御さんには感動して欲しいですね！

そして、普通の価値観を持てる子供を育てたことを誇りに感じて欲しいですね！",32,2025-07-08T11:04:26Z,2025-07-08T11:04:26Z,UC27yT6EzaN7iZRoTgloeAAw
,UgyEeVXEwVutx5uTzlV4AaABAg,UgyEeVXEwVutx5uTzlV4AaABAg.AKJWKzOwV2BAKJZsJ_rCex,True,@あけみ金子,😚💞🙏,20,2025-07-08T11:14:01Z,2025-07-08T11:14:01Z,UCxFs6PEkv1n0PWAZAjEMO7w
,UgyEeVXEwVutx5uTzlV4AaABAg,UgyEeVXEwVutx5uTzlV4AaABAg.AKJWKzOwV2BAKJ_xsSE4Le,True,@user_yuu,"ありがとうございます。
自分も家族に伝えたいと思います🇯🇵🧡",23,2025-07-08T11:23:31Z,2025-07-08T11:23:31Z,UC7kn16cuBeZj8hZ6vmuJB9Q
,UgyEeVXEwVutx5uTzlV4AaABAg,UgyEeVXEwVutx5uTzlV4AaABAg.AKJWKzOwV2BAKK7VVqP-rO,True,@おのたまき,やったー！有難うございます!!,10,2025-07-08T16:25:20Z,2025-07-08T16:25:20Z,UCkE0VDzKBRP9aFI8S8q-6vg
,UgyEeVXEwVutx5uTzlV4AaABAg,UgyEeVXEwVutx5uTzlV4AaABAg.AKJWKzOwV2BAKM8bBW4zHx,True,@user-to6si7ws2n,⁠​⁠@@ずーたむありがとうございます！こんな温かい言葉をかけて下さる皆さんと同志なのを誇りに思います！！,3,2025-07-09T11:13:28Z,2025-07-09T11:13:28Z,UCfq-v9zpbC6A5VWrSczBkFw
PYz0CvEukvE,,Ugw0qQ7froWnqBqqO_R4AaABAg,False,@ruru-sk4rh,"共産党の神谷特集　😂
回答24:09 から",4,2025-07-08T10:41:37Z,2025-07-08T10:41:37Z,UCNykE8wuLhaPeaalPZevJ7g
PYz0CvEukvE,,UgxL586P2OEc4Qwm2p94AaABAg,False,@なすがまま-f5w,聞けば聞くほどれいわ。是非山本太郎と対談して欲しい。色々考え方あるけど新しい台風の目は参政党。れいわも風穴を開ける初動としてはかなり尖ってたし何なら過激だった。参政党は対決より解決(これは国民民主寄り)やから何かホントに頑張らなきゃって。皆で考えるのが参政党だなって。こういう考え、動く事、投票する事が1番大事。皆さん投票行きましょう。私も行きました。今こそ国民の意思を示す時だと思います。,6,2025-07-08T10:40:44Z,2025-07-08T10:40:44Z,UCiEhy2poKvWFk-29auME99w
PYz0CvEukvE,,Ugw_814pzjUtfp0rGKd4AaABAg,False,@稲葉光行,加藤つとむに期日前投票で入れました。参政党に期待しています。,92,2025-07-08T10:40:16Z,2025-07-08T10:40:16Z,UCjOOY0dECmBHiJAKQB2xyAw
PYz0CvEukvE,,UgxMolmrO7xSv_6x-cJ4AaABAg,False,@tetesky9835,"青森県民です　
涙目になりながら
演説聞きました
参政党一択です
一緒に頑張りましょ！！",540,2025-07-08T10:38:58Z,2025-07-08T10:38:58Z,UCjFejUU_H1NUO1kJL-w2z8g
,UgxMolmrO7xSv_6x-cJ4AaABAg,UgxMolmrO7xSv_6x-cJ4AaABAg.AKJVr_xvBgkAKKkVK-01HJ,True,@JUN-f1t9i,はじめまして　俺も前の方で観てました　青森市の保守の参政党支持してます　俺も感動してウルウルきて涙流してました😭俺参政党はいりたいですが　山田高校卒のなんのスキルもない人見知りのバカがはいっても〜足をひっぱるだけなので〜影ながら応援するだけにしてます😅　俺自信今後悔してます　もう少し若い時に勉強して大学はいって考えればよかった(⁠-⁠_⁠-⁠;⁠)　愛国心は人一倍あるのに〜バカですよ,19,2025-07-08T22:14:51Z,2025-07-08T22:14:51Z,UC6f_qI40_elKY3Wg9BdTNzQ
,UgxMolmrO7xSv_6x-cJ4AaABAg,UgxMolmrO7xSv_6x-cJ4AaABAg.AKJVr_xvBgkAKKy1IKYZS5,True,@ユウスイ-o5t,"​@@JUN-f1t9i
初めまして😊
私はもうすぐ50歳になるもので、青森駅前公園で演説聞いて激しく頷いていた者す。

今、高卒だとか、関係ないと思います!
想う気持ちがあれば、前に進むことが出来ます。
一人の力だけじゃなく、誰かの支えで、想いが実ります。
帰りに参政党八戸の党員とお話しをしたら、「自分の得意分野でお手伝いしてください」と言ってもらえました。

私もまだ参政党サポーターですが、いつか縁の下の力持ちになりたいと思っています。

参政党の人たちと共に、一緒に頑張りましょう🟠🟠🟠",0,2025-07-09T00:13:05Z,2025-07-09T00:13:05Z,UCwcTNmLkG8zF8gu9shuhAVQ
,UgxMolmrO7xSv_6x-cJ4AaABAg,UgxMolmrO7xSv_6x-cJ4AaABAg.AKJVr_xvBgkAKLAKHHMWfW,True,@user-cj3zb4ok7v,"@@JUN-f1t9i 
議員になるのにも学歴は関係ありません知識を得るための勉強は一生できます
大切なのは学歴でなく学があることです大卒でも愚かな人間はごまんとおります大事なのはどう生きるかです胸を張ってください",11,2025-07-09T02:09:16Z,2025-07-09T02:09:16Z,UC_y0UAOuovwCxL33VjAni-A
,UgxMolmrO7xSv_6x-cJ4AaABAg,UgxMolmrO7xSv_6x-cJ4AaABAg.AKJVr_xvBgkAKLiJoI8ss8,True,@zznn4708,"@@JUN-f1t9iさん
あのさ、誰もができる事ある。
プレゼンの長けてる人、
人前で話せないけど段取り配慮の行き届く人、
とにかく体は頑丈！何処へでもサッと行動できる人、

誰かと渡り合うにはそれなりのスキルいる。
それも社会に出てから身につくものだから、高卒とかじゃなく何かに取り憑かれるように学んできた事が大事だよね。

陰ながらなんで言わず、自分の魅力を再認識して活かしてくだされ、、",6,2025-07-09T07:15:02Z,2025-07-09T07:15:02Z,UCpEK3IfQKQ8BLqZuRUXjKCA
,UgxMolmrO7xSv_6x-cJ4AaABAg,UgxMolmrO7xSv_6x-cJ4AaABAg.AKJVr_xvBgkAKWjhqJE3Up,True,@k_kawtv1960,どういうところが泣いたんですか？,0,2025-07-13T13:58:50Z,2025-07-13T13:58:50Z,UCRnJgP2aS7m-Fe0cKMTDE9Q
PYz0CvEukvE,,UgwLGBV6KcEWzMRYCQd4AaABAg,False,@ひらりえ-x8w,青森県頑張れー！🟠,53,2025-07-08T10:38:36Z,2025-07-08T10:38:36Z,UCMQjh_oLv0l7UpOuLzCUnYA
PYz0CvEukvE,,UgxA0kUiwlKh-bx131B4AaABAg,False,@稲葉光行,党首！ねぇねぇの言い方が気になる。,0,2025-07-08T10:38:06Z,2025-07-08T10:38:06Z,UCjOOY0dECmBHiJAKQB2xyAw
PYz0CvEukvE,,UgxZIwEt2frwDwUK4YF4AaABAg,False,@user-pr8275,"青森県のみなさん、「加藤つとむ」をよろしくお願いします🙇
私は、熊本在住ですが、親父が元自衛官です。友だちは海上自衛隊に入隊しましたが、想像を超える激務だったらしいです。
そんな中、頑張ってこられた、愛国心のある「加藤つとむ」なら日本を任せれる！そう思います。
どうぞ「加藤つとむ」をよろしくお願いします🙇

2枚目の用紙、比例区は「参政党」とお書きください。
よろしくお願いします🙇",210,2025-07-08T10:37:25Z,2025-07-08T10:37:25Z,UCpSgSg2VHuER3IN5PjGRXbg
PYz0CvEukvE,,Ugy6YE5a40AAKgh3mxN4AaABAg,False,@Rachox,"青森市在住です！
参政党に自分達の未来を賭けて投票します！！",286,2025-07-08T10:36:50Z,2025-07-08T10:36:50Z,UCsbIJF2iOqMFyaF0HZJidig
,Ugy6YE5a40AAKgh3mxN4AaABAg,Ugy6YE5a40AAKgh3mxN4AaABAg.AKJVc0ez24IAKKy-viExYa,True,@menomeeeery,NICEです！🟧,4,2025-07-09T00:12:53Z,2025-07-09T00:12:53Z,UC8rUrWZzPOgqREpew93Wgwg
PYz0CvEukvE,,UgxpSKvVIJh5remVpIx4AaABAg,False,@kazuhirosugohata8499,"ほんと
せめて賞与ボーナスだけでも
何も取らないで下さい
毎年
総額は上がってるのに
手取り現状維持
毎回
引かれる金額15万
せめて
ボーナスぐらいね
経済効果ないですか？",6,2025-07-08T10:35:33Z,2025-07-08T10:35:33Z,UCHgazL9j0DyMtgNcMMud17w
PYz0CvEukvE,,UgwuQFRJGuKWcfvnfN14AaABAg,False,@じゃむ-z8l,青森にもやっと応援したい党が来てくれました！,140,2025-07-08T10:34:26Z,2025-07-08T10:34:26Z,UCq0s9Jy0MSi-jP0JtzFE6RA
PYz0CvEukvE,,UgzP5jkYj3qZYZUNYSZ4AaABAg,False,@はなちゃん-u3t,うわー！私関西在住やけど青森県大好きなんです！ホンマに温かくて真面目な優しい人はがりでした！また行きたいなー！なんだか嬉しい,22,2025-07-08T10:34:02Z,2025-07-08T10:34:02Z,UCDR5lLaKgO28XicXzxtEk7w
PYz0CvEukvE,,Ugwpk16gYmvtXshqIIB4AaABAg,False,@慎也-h4s,加藤さんには、当選してほしい！応援してます,14,2025-07-08T10:32:27Z,2025-07-08T10:32:27Z,UCtkCc1YKXtOUKNldALKUZlw
PYz0CvEukvE,,Ugy_Z6ZA1RYs7mAZTcp4AaABAg,False,@佐々木龍彦-c3j,"ブレるなよ。俺もブレない。
参政党一択！",216,2025-07-08T10:32:15Z,2025-07-08T10:32:15Z,UC0t_6INKH0YBnVFpjoW1EOQ
,Ugy_Z6ZA1RYs7mAZTcp4AaABAg,Ugy_Z6ZA1RYs7mAZTcp4AaABAg.AKJV5Llr9KWAKJx37BI-sM,True,@びたみん-d5f,2022年参政党に出会い数え切れ無い動画を観てアンチにもブレず参政党一択です。😊,17,2025-07-08T14:45:21Z,2025-07-08T14:45:21Z,UCc1LdmbTJ_30t4-as3PAECg
PYz0CvEukvE,,Ugy3ODCg-2WyCzofo0h4AaABAg,False,@弁天小僧-i6f,参政党万歳自衛隊万歳!,8,2025-07-08T10:31:52Z,2025-07-08T10:31:52Z,UC5rlhbY6k_5oerlVp6FEpIQ
PYz0CvEukvE,,UgzEaye6Gb1m_UuPPSl4AaABAg,False,@TT-qh9vd,参政党応援してます。,122,2025-07-08T10:31:01Z,2025-07-08T10:31:01Z,UCAA4BImwrhhEz-85fRZhYCw
PYz0CvEukvE,,UgzAUjuD9ZHH2a6X0bF4AaABAg,False,@mitinotabibito,"参政党、強い。参政党はチーム組織・ストーリー・運営の在り方が良い。国民・有権者自身が参加し作り上げている。涙が出る。
完璧ではないが、組織構造に修正力がある。極論すれば、すでに貴方自身が参政党でもある。民意が作った政党だから。皆で学び育てている。
魂と熱量が違う。企業献金なし！利権に媚びない。　もはや迷う必要もない。彼らに任せてみよう！日本人ファースト！参政党・一択！！",93,2025-07-08T10:28:37Z,2025-07-08T10:28:37Z,UCADHYNzfWmcYwF7UGU2XBow
PYz0CvEukvE,,UgxeoL_7RMf0IMDrT-t4AaABAg,False,@_rgmirano6615,神谷さん！暑い中お疲れ様です！！バテずに頑張ってください！✨👏👏,10,2025-07-08T10:28:30Z,2025-07-08T10:28:30Z,UCQpDjO1u41DKh5ybHHI5aIA
PYz0CvEukvE,,UgzITok4yMFLDAVh0fh4AaABAg,False,@SK-wu2eg,"高橋洋一氏の今日の動画で、神谷さんのアジア版NATOの話を取り上げて、ボロっクソに嘆いておられましたよ。多くの人が視聴しているので、無視できない現象が起きるかもしれません。
対応策を検討されておくことをお勧めいたします。🙏",2,2025-07-08T10:25:05Z,2025-07-08T12:21:45Z,UCd3__PekV9J6Sbks-kmv36A
PYz0CvEukvE,,UgwFJrlhI77mll0ngvN4AaABAg,False,@mitosan333,東京から応援します。青森が参政党になるのは、素晴らしい。選挙に行きましょう。日本人ファースト。青森、がんばれ。,344,2025-07-08T10:25:01Z,2025-07-08T10:25:01Z,UCm1OAmdrrTi_ie7GMvmNZtQ
PYz0CvEukvE,,Ugw734MeCtEu_ERPC_54AaABAg,False,@ひでぽんミニ,加藤つとむさん。65歳での出馬、頭が下がります。自衛官の方々の日本への思いを教えていただきありがとうございます。今度は国会中継でその思いをお聞きしたいです。青森の皆さん、ぜひ加藤さんを国会に送り出して下さい。お願いいたします。,48,2025-07-08T10:22:38Z,2025-07-08T10:22:38Z,UC02bLiKo6P6FBnjGt2u7W_Q
PYz0CvEukvE,,UgzPlJF8i4Ia4th7mwx4AaABAg,False,@junnakata1,参政党一択です。皆んなで国民の声で作る新しい日本国を作りましょう！,117,2025-07-08T10:22:09Z,2025-07-08T10:22:09Z,UC1EW5h_iihBrJ6JFC9zl0eQ
PYz0CvEukvE,,Ugy6qObe11tQIz2Uxxd4AaABAg,False,@upaupa4861,"神谷さん青森まで北上しましたね！🍊✨
加藤さん！
党員の皆さん！
青森の皆さん！
札幌からも応援してますっ✊️😤",36,2025-07-08T10:22:05Z,2025-07-08T10:22:05Z,UCfNWU6tGR_Gq2RdSrwn9Dcg
PYz0CvEukvE,,UgzDQ0pFCkEG0TI5RG54AaABAg,False,@asa01053,専業主婦ファースト😂,9,2025-07-08T10:21:09Z,2025-07-08T10:21:09Z,UC-ECzVZd6nBJ5exUdoZ1t7w
PYz0CvEukvE,,UgzvxDrg9bif0esRvJt4AaABAg,False,@cacaot9571,47:10〜神回,10,2025-07-08T10:19:52Z,2025-07-08T10:19:52Z,UCZIlK5p0-btoluMghibs8vg
PYz0CvEukvE,,Ugy43K2NrbxKWbrasU14AaABAg,False,@asa01053,神谷さんの息子、公立、フリースクールの二刀流ですか😅,2,2025-07-08T10:19:51Z,2025-07-08T10:19:51Z,UC-ECzVZd6nBJ5exUdoZ1t7w
PYz0CvEukvE,,UgxmpPHoBfh_f-SjOX94AaABAg,False,@googleyahoo9063,間に合わなかった！行きたかったです,20,2025-07-08T10:19:35Z,2025-07-08T10:19:35Z,UC7UxnB5zuRvvw6g0OrFj5Mg
PYz0CvEukvE,,UgyZghH2zdPFNXqywA14AaABAg,False,@凡士-j1t,こんなに熱い演説があっただろうか。いやない。,115,2025-07-08T10:19:18Z,2025-07-08T10:19:18Z,UCdLBTyvQv5gDK0w0aBW095Q
PYz0CvEukvE,,Ugz5ohY9A5e4WFiwuDl4AaABAg,False,@asa01053,ダボス会議でジェンダー指数ですか😅,3,2025-07-08T10:17:56Z,2025-07-08T10:17:56Z,UC-ECzVZd6nBJ5exUdoZ1t7w
PYz0CvEukvE,,UgyJByT_yOpea3vpxql4AaABAg,False,@アンミシェル,泣ける,28,2025-07-08T10:16:26Z,2025-07-08T10:16:26Z,UCjv9H4_OB5_zNsQoh0beDOA
PYz0CvEukvE,,UgxLB7QJvaKsgi7Z3XN4AaABAg,False,@ナタリー0312,"仙台から応援してます📣青森の皆さんお願いしますねぇ🙏
1.2．参政党〜🧡",120,2025-07-08T10:16:24Z,2025-07-08T10:16:24Z,UCmPF_SdDkvf3ol-K9nK5Zfg
PYz0CvEukvE,,UgxPNAlfwQQIHcQwmIl4AaABAg,False,@takashi-y1l,"街頭演説に参加してきました、ワクワクする未来を予感させるいい演説でしたよ。
平日の青森市でこんなに聴衆を集めるなんて凄いですね。",98,2025-07-08T10:16:04Z,2025-07-08T10:16:04Z,UCd3PY3pjo3qhPWkVKl0G5Ww
PYz0CvEukvE,,UgzGwUDvEYin32DPnkt4AaABAg,False,@ジムタク,"激アツ　漢　神谷（呼び捨てすいません）
なんか目から水が出てきた…
うちの女性陣（妻、母、義理母）は参政党に投票すると固い意思です。",158,2025-07-08T10:15:49Z,2025-07-08T10:15:49Z,UCQxkTxRbGU36WvzK6xumQuQ
PYz0CvEukvE,,Ugxh3_CsN6DiSRJ_qRV4AaABAg,False,@asa01053,立憲共産党ヤバすぎだろ😅,0,2025-07-08T10:15:48Z,2025-07-08T10:15:48Z,UC-ECzVZd6nBJ5exUdoZ1t7w
PYz0CvEukvE,,UgyzOEUYWMrcd_CZa4B4AaABAg,False,@りんごタタン,是非もなし！！加藤さん！！けっぱってけれ！！,10,2025-07-08T10:15:00Z,2025-07-08T10:15:00Z,UC2Tpom0s8clvMZJUDQPxc4w
PYz0CvEukvE,,Ugxv3l8CtpTpF3wX5H54AaABAg,False,@いちまる日記,"青森県民です。
本当に参政党はこの日本国の希望です！
7/20の参議院選挙は加藤つとむさん
比例は参政党！
妻と一緒に投票します！",144,2025-07-08T10:14:54Z,2025-07-08T10:14:54Z,UCq-EH6qceBgTaJAgr-_ZU7g
,Ugxv3l8CtpTpF3wX5H54AaABAg,Ugxv3l8CtpTpF3wX5H54AaABAg.AKJT6LH2g06AKJWUGtIFuV,True,@altowarks,俺も行きます！,11,2025-07-08T10:44:23Z,2025-07-08T10:44:23Z,UCqnDWQbH-oJYYTwseiJO2Xw
PYz0CvEukvE,,UgwNQB1MRqszOm5qyl14AaABAg,False,@398hana4,加藤さん後藤さん本日は暑い中外ヶ浜町や今別までありがとうございます😊仕事で夕方駅前まで行けませんでしたが、実際にお話しできて良かったです。日本人ファースト！参政党応援してます🎉神谷さん青森までお越しいただきありがとうございます😊,19,2025-07-08T10:14:49Z,2025-07-08T10:14:49Z,UC0YwGIgEatH7T24HmrEzVRw
PYz0CvEukvE,,UgwgJ-emdZf49k7QkAd4AaABAg,False,@ひでぽんミニ,神谷さんの演説を毎日聴いて、毎日元気をもらっています。日本が大好きです。日本はこれからです。ありがとう。頑張ります。,76,2025-07-08T10:13:51Z,2025-07-08T10:13:51Z,UC02bLiKo6P6FBnjGt2u7W_Q
PYz0CvEukvE,,UgxGLohaTurepitCoiB4AaABAg,False,@にんにん-v6w,青森市に来てたの知らなかった。行けたのに残念,32,2025-07-08T10:13:39Z,2025-07-08T10:13:39Z,UCbQ9rk-RKejVyzCBvrtAGOg
PYz0CvEukvE,,Ugy2cbXP_gPmlDps4Td4AaABAg,False,@Alex-k5l4f,"青森県民の皆様お疲れ様でした。参政党が、今の腐った政治体質を変えてくれると思います！！
明日は、いよいよ売国奴県知事が牙城を築いてる北海道です。参政党の力で、崩すことができると思います。全力で応援します！",2,2025-07-08T10:13:19Z,2025-07-08T10:13:19Z,UCtmhNdD24OUiqv5xviJzMcA
PYz0CvEukvE,,UgwCnd2r3F5TtTQkT-F4AaABAg,False,@まるか-p9g,農業者は参政党一択！自民党立憲共産党国民民主党ではよくならない！,19,2025-07-08T10:09:48Z,2025-07-08T10:09:48Z,UCk04jcV_OMCHrdteyTlV3eQ
PYz0CvEukvE,,UgwKeuguMd2jqxlsWUZ4AaABAg,False,@タイガーhihi,"赤旗はイイ感じで参政党の演説のネタを提供してくれている！
　墓穴を掘っちゃったな～♫",15,2025-07-08T10:09:41Z,2025-07-08T10:09:41Z,UC66PDMvqueltOFf3nxIyvFA
PYz0CvEukvE,,Ugx_sAPn0_YZIoESaaN4AaABAg,False,@ともとも-w1k,神谷さん最高ですよ👍,52,2025-07-08T10:08:49Z,2025-07-08T10:08:49Z,UCY_Vmz49ifpzwXMBOPTXkjw
PYz0CvEukvE,,Ugx9srN3osuTVkoihON4AaABAg,False,@ゆたかチャコ,橙色の炎を、希望の炎を燃やせ‼🔥🔥🔥🔥🔥🔥🎉🎉,26,2025-07-08T10:07:26Z,2025-07-08T10:07:26Z,UCE25fa7b_V6Gx2azb_LUIGA
