videoId,parentId,commentId,isReply,authorDisplayName,text,likeCount,publishedAt,updatedAt,authorChannelId
6T-zvSowRVE,,UgwbDjrVI41zGN0suTZ4AaABAg,False,@namenana4457,バ神谷被疑者てめー🐴🦌な小細工使ってんじゃねーよwwwwあの日の丸の✖てめーら参政党の自作自演だろ分かってんだぞwwww,0,2025-07-08T11:39:05Z,2025-07-08T11:39:05Z,UCMMErwOLokduzZEb3zSdjYw
6T-zvSowRVE,,UgwOghvNtaGeDWQqwBJ4AaABAg,False,@にい-e1k,"声で誰かわかるわ！
←の記者ですなぁ‼️",25,2025-07-08T11:38:39Z,2025-07-08T11:38:39Z,UCct4KxPbD_AK6FIvF_LURsg
,UgwOghvNtaGeDWQqwBJ4AaABAg,UgwOghvNtaGeDWQqwBJ4AaABAg.AKJbggZdTF0AKJboTydZY3,True,@にい-e1k,←の=左の記者！,5,2025-07-08T11:39:43Z,2025-07-08T11:39:43Z,UCct4KxPbD_AK6FIvF_LURsg
6T-zvSowRVE,,UgzCnSH1I4J4i7Ice014AaABAg,False,@usuki.f,"なんや、この記者💢
あんたらが変に切り取ったんじゃないの？",274,2025-07-08T11:36:25Z,2025-07-08T11:36:25Z,UClmD0KJEQOuX8OvPIe1WL2g
,UgzCnSH1I4J4i7Ice014AaABAg,UgzCnSH1I4J4i7Ice014AaABAg.AKJbRNjldjUAKK8d2AI2ba,True,@tatajam-dx8km,"元朝日新聞の佐藤章です
一月万冊にチャンネルがあります",13,2025-07-08T16:35:15Z,2025-07-08T16:35:15Z,UCr6qTzjHoSUy2wovth6GUuQ
6T-zvSowRVE,,UgwmCm5sCWZwk5EtVQZ4AaABAg,False,@ひさよ13,"🌾⛩️

　神谷代表よくブチ切れずに相手するなぁ～
私だった３回くらい殴り倒してるかも‥なぁんて🤭",58,2025-07-08T11:32:24Z,2025-07-08T11:32:24Z,UCJK66d92Tj4B4hCAV-HneNQ
,UgwmCm5sCWZwk5EtVQZ4AaABAg,UgwmCm5sCWZwk5EtVQZ4AaABAg.AKJayyWJmNXAKJct8DeNSJ,True,@namenana4457,だから参政党信者はこの程度の低レベルなんだよ🐴🦌wwww,0,2025-07-08T11:49:05Z,2025-07-08T11:49:05Z,UCMMErwOLokduzZEb3zSdjYw
,UgwmCm5sCWZwk5EtVQZ4AaABAg,UgwmCm5sCWZwk5EtVQZ4AaABAg.AKJayyWJmNXAKJfFdkPnLi,True,@一男永井-k8i,同じく‼️,12,2025-07-08T12:09:46Z,2025-07-08T12:09:46Z,UC846o7djYS3GAVc0M1vdl7g
,UgwmCm5sCWZwk5EtVQZ4AaABAg,UgwmCm5sCWZwk5EtVQZ4AaABAg.AKJayyWJmNXAKJlFxNVvr_,True,@abandoning-cat,わたしゃ5回！,7,2025-07-08T13:02:15Z,2025-07-08T13:02:15Z,UCONDbdbFujn7Y2kxcwMcXkA
,UgwmCm5sCWZwk5EtVQZ4AaABAg,UgwmCm5sCWZwk5EtVQZ4AaABAg.AKJayyWJmNXAKJmFc_t8Lp,True,@ペンギンpon,わたしゃ跳び蹴り,7,2025-07-08T13:10:56Z,2025-07-08T13:10:56Z,UC9RDBBbyN3PC09CBS-vJf3w
,UgwmCm5sCWZwk5EtVQZ4AaABAg,UgwmCm5sCWZwk5EtVQZ4AaABAg.AKJayyWJmNXAKNCUCkxPIi,True,@和芳-j7g,ワシは上段回しげり😅,0,2025-07-09T21:06:35Z,2025-07-09T21:06:35Z,UCO37tEUe2KOaVQehHOfd3Kw
6T-zvSowRVE,,Ugy5gDpHtQ1Wtv9fF394AaABAg,False,@11maple21,"高齢女性に産めと
でも言って欲しいの？",184,2025-07-08T11:30:59Z,2025-07-08T11:30:59Z,UClQaMNcsX3CmmSjA7KjulTw
,Ugy5gDpHtQ1Wtv9fF394AaABAg,Ugy5gDpHtQ1Wtv9fF394AaABAg.AKJaoZIyAZ3AKJn-UNxv97,True,@tamtamworld0625,いってあげるけどね。いってほしいなら。,8,2025-07-08T13:17:28Z,2025-07-08T13:17:28Z,UCEhRrubUEYrlJeAK3_xSoxA
,Ugy5gDpHtQ1Wtv9fF394AaABAg,Ugy5gDpHtQ1Wtv9fF394AaABAg.AKJaoZIyAZ3AKJt4tZiN3w,True,@masterryuu4457,産めないとは言ってない、リスクの問題だろうよ…色々弊害が出るだろうしねぇ,11,2025-07-08T14:10:38Z,2025-07-08T14:10:38Z,UCAhcj3yJCNH0G19wWAU7OKA
,Ugy5gDpHtQ1Wtv9fF394AaABAg,Ugy5gDpHtQ1Wtv9fF394AaABAg.AKJaoZIyAZ3AKK-P-4UWxO,True,@namenana4457,そう言う問題じゃねーんだよ🐴🦌ヤローwwwwその次の発言で炎上してんだよ🐴🦌wwwwつまりなバ神谷被疑者は「女子高生は大学に行かず妊娠しろ」発言で炎上してんだよ🐴🦌wwwwつまりロリを認めろって言ってるようなもんだよ🐴🦌wwww冷静さかねーんだよ🐴🦌参政党信者はwwww,0,2025-07-08T15:14:33Z,2025-07-08T15:14:33Z,UCMMErwOLokduzZEb3zSdjYw
,Ugy5gDpHtQ1Wtv9fF394AaABAg,Ugy5gDpHtQ1Wtv9fF394AaABAg.AKJaoZIyAZ3AKOH_xut-x4,True,@harumiinoue5607,@@masterryuu4457事実しか言ってないですよね。年を重ねるとリスクもあるし、50代の妊娠確率は1%以下、60代、70代はさすがに産めないですしね💦,0,2025-07-10T07:10:26Z,2025-07-10T07:10:26Z,UCxK2RS3BmoTZBzeSOc07q3w
,Ugy5gDpHtQ1Wtv9fF394AaABAg,Ugy5gDpHtQ1Wtv9fF394AaABAg.AKJaoZIyAZ3AKRc5zlOXHt,True,@akid-kr3wk,"高齢者って一括りにするから馬鹿にはわかりづらいのかな？
70代女性に妊娠してくださいってことですか？って具体的な数で言いたい笑
母子ともに死ぬわw",0,2025-07-11T14:16:10Z,2025-07-11T14:16:10Z,UCcpwKex0X--8tRir-JGkYew
,Ugy5gDpHtQ1Wtv9fF394AaABAg,Ugy5gDpHtQ1Wtv9fF394AaABAg.AKJaoZIyAZ3AKTLgjTvlgX,True,@ナンナオルテガ,"閉経した女性とか言うと、今度は人権団体的な人達が代理出産は出来るとか騒ぐんでしょうね。

実際に子育ては体力勝負、友人で30代後半で3人目を授かった人は上の2人（中学生、小学高学年）がお世話してくれて助かると言ってましたよ。
初産だったら経験もないので本当に大変だったと思いますよ💦",1,2025-07-12T06:22:31Z,2025-07-12T06:22:31Z,UCGKYLFCRtwjxu22pDaUsOKA
,Ugy5gDpHtQ1Wtv9fF394AaABAg,Ugy5gDpHtQ1Wtv9fF394AaABAg.AKJaoZIyAZ3AKZ6uIiJnpg,True,@ジョルジュブラウン,@@ナンナオルテガ 凄いね！！子供は宝だよ！！,1,2025-07-14T12:08:45Z,2025-07-14T12:08:45Z,UCPzvYdUrIkdB6eiTZRvej2A
,Ugy5gDpHtQ1Wtv9fF394AaABAg,Ugy5gDpHtQ1Wtv9fF394AaABAg.AKJaoZIyAZ3AKc4q8ejfhy,True,@ナンナオルテガ,"@@ジョルジュブラウン
本当、子供は自分達の宝、國の宝でもあります。
その子供たちが将来、希望が持てこの國に生まれて良かったと思える國を残さなければならないと思います。
生活に余裕があればもう1人2人子供を産みたかったなと今でも思いますよ。",0,2025-07-16T01:07:39Z,2025-07-16T01:07:39Z,UCGKYLFCRtwjxu22pDaUsOKA
6T-zvSowRVE,,UgyiawrS0dRif_XeaeJ4AaABAg,False,@naoe4428,"高齢者　高齢者って　この記者の人の方が失礼です‼️
神谷代表しっかり答えてくれてます、
負けるな　頑張れ👍",239,2025-07-08T11:28:18Z,2025-07-08T11:28:18Z,UCwnsv5Q0E23gF-W2Lez8CSw
,UgyiawrS0dRif_XeaeJ4AaABAg,UgyiawrS0dRif_XeaeJ4AaABAg.AKJaVtbPgF5AKK0Y_dDQlI,True,@ハート-f2q,佐藤章一月万冊,9,2025-07-08T15:24:36Z,2025-07-08T15:24:36Z,UC8qDMpC53375H3TCbZ_stqA
,UgyiawrS0dRif_XeaeJ4AaABAg,UgyiawrS0dRif_XeaeJ4AaABAg.AKJaVtbPgF5AKMazwIRtrQ,True,@eggnee,ほんとにその通りです,6,2025-07-09T15:30:16Z,2025-07-09T15:30:16Z,UC65xT5hyyDCaunDv0E3oDVw
6T-zvSowRVE,,UgwQQPPZSzTkwhK6ctp4AaABAg,False,@joker30398,逃げたんじゃねえだろ、時間だろ？ 挑発記者はどうしようもない,190,2025-07-08T11:27:51Z,2025-07-08T11:27:51Z,UCMd9Z4bIDn4O-UKCSUo4BbQ
,UgwQQPPZSzTkwhK6ctp4AaABAg,UgwQQPPZSzTkwhK6ctp4AaABAg.AKJaSZTcRQMAKJdCx_jjkQ,True,@namenana4457,逃げまくってんじゃんバ神谷被疑者の奴wwwwブロックするわwwww質問にも答えねーわwwwwひろゆきの件も逃げてるわwwww駄目駄目じゃんwwww,0,2025-07-08T11:51:56Z,2025-07-08T11:51:56Z,UCMMErwOLokduzZEb3zSdjYw
,UgwQQPPZSzTkwhK6ctp4AaABAg,UgwQQPPZSzTkwhK6ctp4AaABAg.AKJaSZTcRQMAKKBJhNGJcL,True,@bacadian,逃げるな！　都合の良い言葉ですね、尻尾巻いて逃げたと印象操作される視聴者も多いことでしょう。,13,2025-07-08T16:58:41Z,2025-07-08T16:58:41Z,UCnZgYOV45PlqAA9ge3dkMsw
,UgwQQPPZSzTkwhK6ctp4AaABAg,UgwQQPPZSzTkwhK6ctp4AaABAg.AKJaSZTcRQMAKKC5TBEBf6,True,@cafe9119,@@bacadian記者の会社に抗議しましょう,16,2025-07-08T17:05:29Z,2025-07-08T17:05:29Z,UC8MqjFdVFfYq79hJFRJfb7w
,UgwQQPPZSzTkwhK6ctp4AaABAg,UgwQQPPZSzTkwhK6ctp4AaABAg.AKJaSZTcRQMAKY6NxOFyn1,True,@user-hm6cb9dx1o,高齢は60．70代のこと。分かってないのかな,2,2025-07-14T02:44:57Z,2025-07-14T02:44:57Z,UCZ-3c5Rkrzaf41kj_YCfi7A
,UgwQQPPZSzTkwhK6ctp4AaABAg,UgwQQPPZSzTkwhK6ctp4AaABAg.AKJaSZTcRQMAKZ5vafTodP,True,@ジョルジュブラウン,高齢はどこで誰がどう判断するのかな？　　高齢者自身でしょう！！,2,2025-07-14T12:00:10Z,2025-07-14T12:00:10Z,UCPzvYdUrIkdB6eiTZRvej2A
,UgwQQPPZSzTkwhK6ctp4AaABAg,UgwQQPPZSzTkwhK6ctp4AaABAg.AKJaSZTcRQMAKhagjihWu8,True,@富士美-u4p,揚げ足、捕るしかみえない,1,2025-07-18T04:30:56Z,2025-07-18T04:30:56Z,UCNWBQQLf6lTRwLQKfHhQeXg
6T-zvSowRVE,,Ugw8AcWMYdKMpDUnMVp4AaABAg,False,@香前田,高齢者は産めないのは当たり前の発言。それをガタガタと言ってる記者が問題あり！,315,2025-07-08T11:23:44Z,2025-07-08T11:23:44Z,UCg9CULyNf6AYtjbO8Wm2RSw
,Ugw8AcWMYdKMpDUnMVp4AaABAg,Ugw8AcWMYdKMpDUnMVp4AaABAg.AKJ_zSZRm3jAKJdJnA0Qjs,True,@namenana4457,ガタガタ言って当然だよ🐴🦌だろてめーwwwwバ神谷被疑者が問題起こしてるからこうなってんだよ🐴🦌wwww,4,2025-07-08T11:52:52Z,2025-07-08T11:52:52Z,UCMMErwOLokduzZEb3zSdjYw
,Ugw8AcWMYdKMpDUnMVp4AaABAg,Ugw8AcWMYdKMpDUnMVp4AaABAg.AKJ_zSZRm3jAKJpIB5dNp6,True,@ranran7625,"高齢者が生物学的に産めないのは当たり前。男が産めないのも当たり前でしょ？　あほと違うの
高齢出産だって、流産や奇形児のリスクがあるわけだし、20代のうちに産んだ方がいいのは当たり前じゃないの",0,2025-07-08T13:37:30Z,2025-07-08T13:37:30Z,UCTNveRvYn1GOyG4l9cDdXjQ
,Ugw8AcWMYdKMpDUnMVp4AaABAg,Ugw8AcWMYdKMpDUnMVp4AaABAg.AKJ_zSZRm3jAKJwDJ3JTdJ,True,@香前田,てめえってナンや💢目立ちたいか何か知らんけど寝とけ！,0,2025-07-08T14:38:00Z,2025-07-08T14:38:00Z,UCg9CULyNf6AYtjbO8Wm2RSw
,Ugw8AcWMYdKMpDUnMVp4AaABAg,Ugw8AcWMYdKMpDUnMVp4AaABAg.AKJ_zSZRm3jAKK-5jObAF1,True,@ジョジョブラック,"​@@namenana4457
オマエ、なにイキってるんや！しょーもない(^_^;)",0,2025-07-08T15:11:55Z,2025-07-08T15:11:55Z,UCWuMGhwFoRDUsUC6Kw2_Ixg
,Ugw8AcWMYdKMpDUnMVp4AaABAg,Ugw8AcWMYdKMpDUnMVp4AaABAg.AKJ_zSZRm3jAKK0jWHwQRa,True,@ハート-f2q,佐藤章一月万冊,10,2025-07-08T15:26:14Z,2025-07-08T15:26:14Z,UC8qDMpC53375H3TCbZ_stqA
,Ugw8AcWMYdKMpDUnMVp4AaABAg,Ugw8AcWMYdKMpDUnMVp4AaABAg.AKJ_zSZRm3jAKK7_e-yWP1,True,@UNMEISEN00,@@namenana4457 兵庫県知事攻め愚か者の難癖付けか。当然とはあんたの頭の中の妄想世界だけの話だろう。どこぞの国の民は文章の理解力が極端に低いらしいが、あんたはどこぞの国の人ではないですか！,0,2025-07-08T16:26:03Z,2025-07-08T16:26:03Z,UCHxKA6OpcpCBzTBPIHmuJzg
,Ugw8AcWMYdKMpDUnMVp4AaABAg,Ugw8AcWMYdKMpDUnMVp4AaABAg.AKJ_zSZRm3jAKKBw5pdz_F,True,@cafe9119,@@namenana4457なんか可哀想な奴だなお前😅,25,2025-07-08T17:04:04Z,2025-07-08T17:04:04Z,UC8MqjFdVFfYq79hJFRJfb7w
,Ugw8AcWMYdKMpDUnMVp4AaABAg,Ugw8AcWMYdKMpDUnMVp4AaABAg.AKJ_zSZRm3jAKTK45x_YxU,True,@ナンナオルテガ,閉経したら産めないよ。,0,2025-07-12T06:08:22Z,2025-07-12T06:08:22Z,UCGKYLFCRtwjxu22pDaUsOKA
,Ugw8AcWMYdKMpDUnMVp4AaABAg,Ugw8AcWMYdKMpDUnMVp4AaABAg.AKJ_zSZRm3jAKTZ2aLAjzC,True,@berlinetta.,"何回も同じことばかり聞いて、日本語がうまく理解できないのかもしれませんね。
日本人の方じゃないのかも？",4,2025-07-12T08:19:14Z,2025-07-12T08:20:37Z,UCvg00Fn0a2BPOYQ0GDFAysA
,Ugw8AcWMYdKMpDUnMVp4AaABAg,Ugw8AcWMYdKMpDUnMVp4AaABAg.AKJ_zSZRm3jAKZ63mhVCrK,True,@ジョルジュブラウン,@@namenana4457 創価＝公明党の議員支持者かな？　アハハ！,1,2025-07-14T12:01:26Z,2025-07-14T12:01:26Z,UCPzvYdUrIkdB6eiTZRvej2A
6T-zvSowRVE,,UgwCnTFr-ihTcb0h97h4AaABAg,False,@らっきょ-h2c,いいぞ神谷さん、絶対引くんじゃねーぞ！,303,2025-07-08T11:20:09Z,2025-07-08T11:20:09Z,UC6WsXMDawpg7MqOhHC67p_w
FSwvMkpyGSo,,Ugxu1wTRbLOP7ub3gGJ4AaABAg,False,@NARUHODO391,全国比例は浜田聡に1票入れた,0,2025-07-27T04:34:53Z,2025-07-27T04:34:53Z,UCyrNlxVuD6gLCWX4DxuVlwA
FSwvMkpyGSo,,UgyzgWLdCBQgCST32h94AaABAg,False,@鈴木昌彦-u9p,若者に選挙に行ってもらえるような動画配信したら！せっかくのYoutubeなんだから！江田島君の動画で選挙率上げられたら良いね🎉因みに…自公に維新、立憲には投票して欲しくない！日本が変わり始める時ですから‼️,2,2025-07-11T14:54:20Z,2025-07-12T12:24:30Z,UC3xeT-gGsmXg7v7a4DLnIjg
FSwvMkpyGSo,,UgzMWxssVh93mop3H9Z4AaABAg,False,@田部佳,どうせ選挙に行かないくせに。,2,2025-07-10T19:27:33Z,2025-07-11T03:00:47Z,UC0cg1HhHilYjkx86qMmM8og
FSwvMkpyGSo,,UgyK12xfNcFPw1OgErV4AaABAg,False,@umi-g5s,遅れて拝聴しました〜やっぱり江田島さん大好き〜,0,2025-07-08T16:22:23Z,2025-07-08T16:22:23Z,UCPixsBEGinc9zr12OFQYlYw
FSwvMkpyGSo,,Ugz0k4hFqmKTFiMfbSB4AaABAg,False,@ララ-b2v,"世の中なったもん勝ちというか…
下があーだこーだ言っても痛くも痒くもねーというか…
やりたいようにやるには偉くなるしかねーんじゃねーの？",2,2025-07-08T13:35:36Z,2025-07-08T13:35:36Z,UC-qp4eUeIwRoxN0zYP27UeQ
FSwvMkpyGSo,,UgyqxjZ0D0bCHAOetkZ4AaABAg,False,@hirona_,「れいわは10万円😊」,0,2025-07-08T03:50:46Z,2025-07-08T03:50:46Z,UCiIkvG1GBhA2IPFhepD8i7A
FSwvMkpyGSo,,Ugz8dQnyDZ5l_QK5AZJ4AaABAg,False,@S44moto,選挙どうなるでしょうね～、4年くらい前に家族に参政党の党首が凄いって話をしてて、その時に家族に神谷さんの演説動画を見せても全くピンと来てなかった、だけど最近ようやく当時に言ってた意味を理解してくれたっぽい,4,2025-07-08T03:26:47Z,2025-07-08T03:26:47Z,UCYO6OXgcs2jfm_5a1ZwQlQw
FSwvMkpyGSo,,UgzgcCINXAzrka1kdO94AaABAg,False,@lifeinyourwayway,小泉進次郎さんですよね？,1,2025-07-08T01:39:52Z,2025-07-08T01:39:52Z,UC3yZ6QpM7msRL9KNJfwhkIA
FSwvMkpyGSo,,Ugz4bWhRsLMwl4bnwmd4AaABAg,False,@矢野陣太郎,NHK党が良いな！！,1,2025-07-08T00:40:38Z,2025-07-08T00:40:38Z,UCzqHCdNSM5gIFqrp227RFZw
FSwvMkpyGSo,,UgzdRyX5fFnKVyCyJLh4AaABAg,False,@ゆずる-p3o,おはようございます🙇‍♀️選挙誰だろ😅❓あまり気にしてないです😂,1,2025-07-08T00:36:16Z,2025-07-08T00:37:07Z,UChodu1f7Gn7RDbdJsNmiZQg
FSwvMkpyGSo,,UgwkrJpgq7iNBXsFcO94AaABAg,False,@穴の穴にダンゴムシ,今からアーカイブ見るよ,3,2025-07-07T22:31:47Z,2025-07-07T22:31:47Z,UCe41XM8AmI0fGEAqn-VVo3Q
TL7qaK2Pu-0,,UgxZ_bpYCWXR5sZFetx4AaABAg,False,@安部勝子-f8j,"まぁ20日まで数日あるから検討するけど！

社会保障費だの！
高齢化で色々と言うけど。。

そもそも生活介助だけでも一般に頼めば清掃業者で国の支援もなく！
福祉やから支援がある！
金一つ。

だから男も女も働く時代と言うなら家事も負担やし！
家事や子育てで離婚率も上昇やし！

仕事して家事して炊事して子育てして！
本当に酷い時代と思う！
昔は旦那の金で食えたから各々の役割でまだ持つ人は持ち！
下手したら金まで女が用意して炊事や家事と。。

そんな時間も本来は本当に男女平等と言うなら変な話で！

ウチの息子も仕事以外は自分の洗濯物だけする程度で掃除も炊事もなく！

今度、同居する人は資格取得者やから！
実際には私生活となれば家事も炊事もなく！
仕事！仕事！と言うなら同じ様にしたらいいし！
自分に必要な事したら人の家が豚小屋やろうが知らんし！

結局は離婚は
近年の場合は
女が働くと思い！
金を当てにしたり。
互いに働いてるのに家事や育児もせん男なら要らんやん！

そりゃ誰でも仕事して稼ぎたいなら！
そもそも家の事が負担で。

同居人のはなしの離婚も。。
嫁は仮に仕事して家庭しても給与の差が我慢に繋がるけど！
旦那の方が稼ぐなら！！

結局は自分でも稼げる額を稼がれて
子育てに家事になら
離婚よね。

そもそも女居らんと
豚小屋時点で家の事やらする男はまず居らん！

それが母親でも女房でも同じ！

私やら私より家事が出来る男を見た事なく！

発達障害者よりも
家事が出来ない時点で！
健常者なら離婚は普通で！

私も子供居るのに
高熱時でも米一つ炊けない男に親の躾に困り。
大きな赤ちゃん！

普通は女房も高熱で
高熱の子供見とるなら帰ったら何かすると思えば！

米炊いても出来ん！
お前達よく寝てるからパチンコ行くと！

後々に3番目の妻と知り本当に辻褄合った！！

だけ社会保障費も
ガンガン使わせる事より。
家事や炊事もままならん様な形を作った自民党は悪い！

旦那の給与たけじや食えん母親達が
仕事に家事に子育てと。。
子供は辛抱しても
大きな赤ちゃんが捨てられて今の離婚率で！！

この政治家の男達が
どー見ても仕事して
家事も炊事も育児も
出来る様な人間やないから！
米一つ。
発言一つ。
結局は辞める羽目になり！！

昔なら家庭だえでも
仕事となったけど。
今は大変！
大きな赤ちゃんが沢山で福祉使いまくると。。
そりゃ金も大変やろ！

私も、もう馬鹿は
これ以上ない！

男みたく仕事！仕事！と。。
家やらほったらかしでも自分の事しときゃ関係ない！

家で無賃金労働より
外行きゃ数時間でも金になる！

⭕️家事の出来ん男も
近年では離婚理由の一つよ！
女も働くのが普通も言われるならね！

なら男も女並みに
家事や炊事が出来んと成立しない！

重荷なだけ！
金でも稼ぐなら別やけど。
それも出来んなら
家事も炊事せんと
平等ではない！",0,2025-07-13T07:41:24Z,2025-07-13T07:41:24Z,UCowNoX2V_kvvnZ_8haVw9QA
TL7qaK2Pu-0,,UgymwgHFwsfJIA247T14AaABAg,False,@user-xj9rc9cn6g,増税する自公。自民の味方、立民・維新。世界で日本だけ４０ヶ月連続、実質賃金低下。異常な政策。それを支える立民・維新。期間限定の食品の消費税０%は、「だったら補助金でいい」と自民に言わせてあげられる。選挙前の協力態勢。,0,2025-07-11T09:46:09Z,2025-07-11T09:46:09Z,UCqG_tVPzdmkFtjT9aGP6__g
TL7qaK2Pu-0,,UgyvGc07DWw6TPfGHLN4AaABAg,False,@てつA,野田さん･･･7/3の宮崎県国富町での選挙演説第一声で、「米高騰の震源地は、この宮崎県ではありませんか」と発言しましたよね。宮崎のＴＶニュースで流れましたし、SNSでも拡散され始めていますよ。宮崎県選挙区の山内かなこさんのライブで注意を促しておきました。,0,2025-07-10T12:06:57Z,2025-07-10T12:06:57Z,UCqt-t0DYQzoLcD2bwR3RZ0w
TL7qaK2Pu-0,,UgzRM41ikr5d9y2yP1N4AaABAg,False,@user-xj9rc9cn6g,自民・立民・維新で増税を行う。７兆円減税を３０００億円でつぶした維新。減税のチャンスに自民の味方をして野党をまとめなかった立民。,0,2025-07-09T10:49:16Z,2025-07-09T10:51:15Z,UCqG_tVPzdmkFtjT9aGP6__g
TL7qaK2Pu-0,,UgwDqI327xLuFQ77Xt54AaABAg,False,@haniwa-z8g,"〇消費税5%→年間約12万減税
〇非正規を減らす。
〇OTC類似薬　保険適用反対
〇奨学金給付制。返済中の人半額に。
滑り止めの入学金は払わなくても大丈夫に。　etc.
こういう政策あげてくれてるのは、共産党です。毛嫌いせず確認してみてください。",0,2025-07-09T07:04:05Z,2025-07-09T07:04:05Z,UCmtNM19mXaKvMgfTX1l4bfw
TL7qaK2Pu-0,,UgypyMexN_21ODRvVzd4AaABAg,False,@maj-z5n,"個人的に、日本維新の会に投票しようと思う。
みなさんどう思いますか？",3,2025-07-09T00:34:46Z,2025-07-09T00:34:46Z,UC1IDi0_RdHLLHs6Y9CMpjcg
,UgypyMexN_21ODRvVzd4AaABAg,UgypyMexN_21ODRvVzd4AaABAg.AKL-W7VMumXAKMC4b9fl7r,True,@あーき-v5,現役世代の特に若者にとってはいいと思う,1,2025-07-09T11:43:50Z,2025-07-09T11:43:50Z,UCRidHPCXyL_TDA0eJOA4-QQ
TL7qaK2Pu-0,,Ugz_chD5sTmEPanw0014AaABAg,False,@Innovade79,"自民、公明、立憲、維新、共産、社民に票を投じては駄目だよ。
自民党を勝たせるための票分散機能でしかなく、これらは外国人保護と難民保護を掲げています。
立憲は就職氷河期世代対策を本気でしてくれるわけではありません。外国人を増やせば求人が減りますから矛盾します。票が分散されてしまうから国民民主、れいわ新選組、参政党のどれかに票を投じてください。",0,2025-07-08T14:34:51Z,2025-07-08T14:34:51Z,UCih9phjI11kuwe2K6N7GymA
TL7qaK2Pu-0,,UgxJMalOLdxTiYa9yyF4AaABAg,False,@yhyhyhyhyhyhyhyhyhxx,石破よりも野田はまし,0,2025-07-08T13:49:56Z,2025-07-08T13:49:56Z,UCKLfEOTJvkfjTY7Ah3CQE_g
TL7qaK2Pu-0,,Ugwd_txzxcUsYGiA5ix4AaABAg,False,@sauna1234,"裏金議員たちが情勢的に当選できそう。。
もうみんな裏金OKていう感じ？？",0,2025-07-08T12:38:50Z,2025-07-08T12:38:50Z,UC8dMTrEZr5Z1kF5Dj4Bq4TA
TL7qaK2Pu-0,,Ugzksy9nca3dpHqngU54AaABAg,False,@ゆうたろう-h7l,"立民よりは国民民主だわ
信用できない",2,2025-07-08T11:57:53Z,2025-07-08T11:57:53Z,UCEncUrcqEJhboQPLBZOSuBg
TL7qaK2Pu-0,,UgyYy3pDPcEh67uyS8V4AaABAg,False,@user-zj5ts2dn6b,"日本人の皆さんお願いだから選挙に行きましょう。
見て見ぬふりはもうやめましょう。",0,2025-07-08T11:47:32Z,2025-07-08T11:47:32Z,UCDN78G_fIYzDVZzGeMJV3aQ
TL7qaK2Pu-0,,UgwXTg6-VpwLTG_4fJN4AaABAg,False,@明石源治ん,"自公、大幅に過半数割れ¯⁠\\⁠_⁠༼⁠ ⁠•́⁠ ͜⁠ʖ⁠ ⁠•̀⁠ ⁠༽⁠_⁠/⁠¯





は、共産と参政の功績。立憲が選ばれたわけではない🤖👈",0,2025-07-08T11:27:39Z,2025-07-08T11:29:11Z,UCehT4l_KtAv9d1DS1Tx16Og
TL7qaK2Pu-0,,Ugyg5G1CDWAwpBeURtN4AaABAg,False,@SHIN-nn3mi,"選挙の制度をそもそも変えたらって思います。
・ネット投票出来るようにする
・選挙権の改定  18歳～70歳まで
80歳とかに選挙権があってなんで小学生に選挙権が無いの？今の小学生は利口です。ましてや、80歳過ぎの方は【何処に入れて良いか分からないから今の党へ】って人も居ます。とにかく選挙に行かなければって考えの人が多いです。そゆ方は選挙に行かない方が良いと思います。ましてや、今の年金は現役世代からとってる制度です。現役世代の票が優先されるべきではないですか？",0,2025-07-08T11:01:42Z,2025-07-08T11:01:42Z,UCKPQvbFQOufo0ygYQcpwmoA
TL7qaK2Pu-0,,UgxK3IAN80g4LCvKuk94AaABAg,False,@南風-q7e,参院選は参政党と保守党とNHK党が良いかなあって思います。,3,2025-07-08T10:01:35Z,2025-07-08T10:01:35Z,UCsEMzTfUBLM9ShwalrKW7Bg
TL7qaK2Pu-0,,UgxTiTNmvIr2XExOawt4AaABAg,False,@tttttt-q4m,今日の朝、立憲の支持者みたいなおばちゃん達が駅前でプラカード持ってなんか喋ってたけど、みんな「うるせぇなぁ」って顔してた,1,2025-07-08T09:52:30Z,2025-07-08T09:52:30Z,UCoHPmX5WkQZg5O8U6GylwsA
TL7qaK2Pu-0,,UgxT5FTwv48HE8-Y34l4AaABAg,False,@鈴木太郎-n1r,"自公と同様に立憲と維新も議席数を減らして欲しいです。
特に立憲。",3,2025-07-08T09:48:37Z,2025-07-08T09:48:37Z,UC4hCnqKs6NTCAKoXNGKTOrg
,UgxT5FTwv48HE8-Y34l4AaABAg,UgxT5FTwv48HE8-Y34l4AaABAg.AKJQ5qPvFv2AKJS8DdUbP0,True,@南風-q7e,そうですね。自公立憲は絶対に駄目ですよ。,1,2025-07-08T10:06:25Z,2025-07-08T10:06:25Z,UCsEMzTfUBLM9ShwalrKW7Bg
TL7qaK2Pu-0,,UgxfwApUi4d5uxi98fl4AaABAg,False,@りき-d4c,"でもあんたら不信任出さないやん
石破を信任したんだよね
同じ穴の狢
自民補完勢力",0,2025-07-08T08:40:47Z,2025-07-08T08:40:47Z,UCPUA6a_uyv8c7DoSnTsUuFw
TL7qaK2Pu-0,,Ugxy9mBFIAK3qEUruQJ4AaABAg,False,@遠藤要-x3b,参政党か,1,2025-07-08T08:28:42Z,2025-07-08T08:28:42Z,UChSSZ3hxlCV7wiXFsLmH97w
TL7qaK2Pu-0,,UgyRv6V4BNYnQ43pEid4AaABAg,False,@user-nm7jq6cu9i,"石破の言葉にはもう飽きた...
自民党は終わりです。　立憲も東日本大震災の時に何も対応できずに国民を激怒させたから無理無理、野田さんも総理時代、約束守らなかったから石破と同じ",5,2025-07-08T07:44:37Z,2025-07-08T07:44:37Z,UCJAMyIZhzVyMg7KNyUwIytg
,UgyRv6V4BNYnQ43pEid4AaABAg,UgyRv6V4BNYnQ43pEid4AaABAg.AKJBuaBQAIJAKJS3Ztlna8,True,@南風-q7e,自公立憲は駄目です。,3,2025-07-08T10:05:47Z,2025-07-08T10:05:47Z,UCsEMzTfUBLM9ShwalrKW7Bg
TL7qaK2Pu-0,,UgxBCSazHW_9Soa89md4AaABAg,False,@輿-j1d,"自公は３０年間景気を良くしなかった
消費税廃止すれば景気は良くなる",11,2025-07-08T07:15:41Z,2025-07-08T07:15:41Z,UCVx6DzNEJjZExZjCTuiydlw
,UgxBCSazHW_9Soa89md4AaABAg,UgxBCSazHW_9Soa89md4AaABAg.AKJ8ahhDQNKAKJSSMO9h_K,True,@南風-q7e,そうですね。失われた30年は自民党の責任ですよ。,3,2025-07-08T10:09:10Z,2025-07-08T10:09:10Z,UCsEMzTfUBLM9ShwalrKW7Bg
TL7qaK2Pu-0,,UgxlKDwxN9n67tNP4Sl4AaABAg,False,@ranran7625,"＞立憲幹部「参政党は保守票を奪っていて大きな影響ない」

つまりだ・・・やっぱり、パヨパヨ政党だったんやｗｗｗｗｗｗｗｗｗ",0,2025-07-08T06:57:04Z,2025-07-08T06:57:04Z,UCTNveRvYn1GOyG4l9cDdXjQ
TL7qaK2Pu-0,,UgzHxFaXTwdklXmioRl4AaABAg,False,@Yumekui1166,皆様、自民に引導を渡そうとじゃありませんか。,0,2025-07-08T06:46:35Z,2025-07-08T06:46:35Z,UCkJi2vWfikghFOwzxIpKzMA
TL7qaK2Pu-0,,Ugwx70VTlyvK-WKbBEZ4AaABAg,False,@大阪のおっさん-b4d,道徳心ゼロの前原が代表である限り維新の党勢拡大はあり得ない,0,2025-07-08T06:06:19Z,2025-07-08T06:06:19Z,UC3cNSXjbj8HbxOQDNGy9hvQ
