videoId,parentId,commentId,isReply,authorDisplayName,text,likeCount,publishedAt,updatedAt,authorChannelId
DU7TJEnlbsQ,,Ugwaoxx-75fDzxT7NmR4AaABAg,False,@blackpanda0719,"安全保障でアジア版NATOをつくりそこに中国もいれてやるって石破総理と同じこと言ってるって高橋洋一先生が幼稚園レベルだよって言ってましたが大丈夫なのか？
しかも米軍を追い出すとか正気の沙汰ではない。
これで議席獲得するのは勘弁しろ。",2,2025-07-08T10:38:59Z,2025-07-08T10:38:59Z,UCJ1tSoFUG6N7DqgMiYPB5qQ
DU7TJEnlbsQ,,Ugwqpt9_q-AJ85KtQzF4AaABAg,False,@BJ-vn2bx,私は東京都民ですが、参政党の全て演説を今の所全部聴きました。大山さんの演説の魂が一番響きました。凄いです。,64,2025-07-08T10:38:47Z,2025-07-08T10:38:47Z,UCb5uhofXDUub4CDYJNVviEQ
DU7TJEnlbsQ,,UgxXX9Ot-DY-PVHRHPF4AaABAg,False,@りな-g3q,"22歳初めて演説に行きました。参政党を知って初めて行きたいと思いました‼️大山さん、神谷さんに生でお会いし演説を聞いて改めて参政党に入れようと思いました！
これからも暑い日々が続きますが、どうかお身体ご自愛ください🍀応援しています！",68,2025-07-08T10:36:22Z,2025-07-08T10:36:22Z,UCACckk9FER_BKGjAPejpkzw
DU7TJEnlbsQ,,UgyKqeUOCuSmIeM7KuZ4AaABAg,False,@YK-yj6ue,これから選挙戦中盤に入ります！！そろそろオールドメディアや叩き屋や週刊誌が何だかんだって、上げ足とって追い込んで来る頃ですよ！仮にそうした際にも参政党に熱い思いがある善良な国民は、やっぱり来たね・・・的な感覚で静観しましょう！！他党への誹謗中傷は控えていきましょう！！😀😄🙂😉,9,2025-07-08T10:22:38Z,2025-07-08T10:22:38Z,UCG1G8Zem6lIx1gh9g4w1LGA
DU7TJEnlbsQ,,Ugx20SVZwUCvYkcIJi94AaABAg,False,@jje8176,参政党の候補者は、真面人ばかり。今の政府は、他国の犬ばかり。,5,2025-07-08T10:18:53Z,2025-07-08T10:18:53Z,UCMf9oroCiG_4dGHq2hxwyAg
DU7TJEnlbsQ,,UgzAkqA6_FcV7xufrkV4AaABAg,False,@ドシャブリ_ぼうず,神谷さん、小林直美さんのバックアップにも来て欲しい。,3,2025-07-08T10:18:16Z,2025-07-08T10:18:16Z,UCFL8atM65t_EIXXWLdTxZ-g
DU7TJEnlbsQ,,UgxwCKDU44dqR-A24wt4AaABAg,False,@EISHIN522,参政党に投票しよう！,63,2025-07-08T10:14:06Z,2025-07-08T10:14:06Z,UCFV1bat_RMAXqGc5NUSoBZQ
DU7TJEnlbsQ,,UgwGz0JtpKqkciWDG094AaABAg,False,@サオ-b9f,神谷さん体調悪そう…頑張れ✨️✨️✨️✨️,9,2025-07-08T10:10:47Z,2025-07-08T10:10:47Z,UCAZsyaygkWaQvy8qssCWuzg
DU7TJEnlbsQ,,UgxLP75xLS9JExQ02aN4AaABAg,False,@サオ-b9f,"大山さん素晴らしい演説！
どんな妨害にも負けず最後まで！
応援してます💪✨️！",15,2025-07-08T10:07:05Z,2025-07-08T10:07:05Z,UCAZsyaygkWaQvy8qssCWuzg
DU7TJEnlbsQ,,UgxremWvKFcO6NXQnhZ4AaABAg,False,@itard8512,自民党　消費税ファースト😤,5,2025-07-08T10:03:49Z,2025-07-08T10:03:49Z,UCXqq4Vvzs3omQSiQdpEwvTw
DU7TJEnlbsQ,,Ugy8LHFSnjHDbAt0Uvd4AaABAg,False,@なるかみ-k6y,"見に行きたかった〜😢
参政党の演説は本当に士気が上がる",10,2025-07-08T09:49:22Z,2025-07-08T09:49:22Z,UChgK4V4h2fJL-E1fPTQY7kg
DU7TJEnlbsQ,,UgwPfRyFntpFLfkQiY14AaABAg,False,@shino0096,心酔するのは気をつけないとと思うのだけど、どう考えてもマトモだと思うのよね。,6,2025-07-08T09:48:42Z,2025-07-08T09:48:42Z,UCKGKgA0gkhml1nuHMiznwgQ
DU7TJEnlbsQ,,UgxBQ4MHTXhVKE89VId4AaABAg,False,@吉蔵-e2b,参政党がれいわ新選組のYouTube登録者数超えたんじゃない？,7,2025-07-08T09:46:42Z,2025-07-08T09:46:42Z,UCYhHrMdMF3NQObBvK5WvRVw
DU7TJEnlbsQ,,UgxUo4Wh4JzETjhqINt4AaABAg,False,@puu8888wo,日本人の覚醒が増えています。日本人バンザイ！！選挙に行こう。投票率80％を超えよう。参政党一択。,8,2025-07-08T09:35:48Z,2025-07-08T09:35:48Z,UCpkjf-bRNwATNLKupGSM9nA
DU7TJEnlbsQ,,UgxdFnOjL0EzVKQUNtd4AaABAg,False,@jpn-mkf_3125,"大山さん良いねぇ〜！！
本気度と熱量がスゲー刺さってくるわ！
いざ！国政へ！！",40,2025-07-08T09:14:04Z,2025-07-08T09:14:04Z,UCJbdg7kUUtiEDNyPIoavz0A
DU7TJEnlbsQ,,Ugw6XJYMe2W-TNm2SpJ4AaABAg,False,@gto5100,大山さんいいね,8,2025-07-08T09:08:32Z,2025-07-08T09:08:32Z,UCzs-BLrloSSE90K_o__TXfA
DU7TJEnlbsQ,,Ugwh3pzLJlt9CQEce154AaABAg,False,@アキ-b4s,参政党一択,9,2025-07-08T08:51:24Z,2025-07-08T08:51:24Z,UCxalf2tDuwnv35clfP8vlGg
DU7TJEnlbsQ,,Ugyw70HHxZ9o1wB46PN4AaABAg,False,@re.St.0,"先達山のメガソーラーは本当に許し難いです。

運転中に太陽に照らされて光って、危ないんですよ。

大山りさこさん、川雄一郎さんに投票しました！

応援しております。",9,2025-07-08T08:48:21Z,2025-07-08T08:48:21Z,UCC5V3K5GTP8rC_yOR45pPmA
DU7TJEnlbsQ,,UgyRyjvVkhYSVP07T094AaABAg,False,@user-wf5em7cs9m,神谷さん少しは休んでください,6,2025-07-08T08:47:18Z,2025-07-08T08:47:18Z,UChf4pi1_JWG0ohKt3jOV5Ow
DU7TJEnlbsQ,,UgwFO7qqbPNrMuuKhxx4AaABAg,False,@apice0219,"大山さん熱い！
国を思う気持ちがよく伝わる😭",16,2025-07-08T08:44:20Z,2025-07-08T08:44:20Z,UCfkDYxGGAbp9auprynzsAdA
DU7TJEnlbsQ,,Ugyea_3IPqFTVktjHmV4AaABAg,False,@坂田-h,日米同盟を廃止しようという姿勢に中国人は喜んでいる,3,2025-07-08T08:43:28Z,2025-07-08T08:43:28Z,UCRWkRnwB_2nR0SerVN7tp_Q
,Ugyea_3IPqFTVktjHmV4AaABAg,Ugyea_3IPqFTVktjHmV4AaABAg.AKJIdbolkEpAKJl8_O17BV,True,@坂田-h,@NOA-oh5ew 実際に防衛できるか否か静観するしかない。こいつらの政策さすがに狂っている。,0,2025-07-08T13:01:14Z,2025-07-08T13:01:14Z,UCRWkRnwB_2nR0SerVN7tp_Q
DU7TJEnlbsQ,,UgzyuFkvGnyFiAydlRB4AaABAg,False,@fxryu-chan6378,"参政党１択です、大山さんに県民の想いを託しましょう。
福島は自民・立憲との三つ巴なので連立を止めるのは福島からです！",12,2025-07-08T08:38:32Z,2025-07-08T08:38:32Z,UC6s1umOLR3EUdg8NKAY7LmA
DU7TJEnlbsQ,,UgzkJHI7x0SWJJSxtxl4AaABAg,False,@安す丸,神谷代表の街頭演説　どこの県の聞いても　五臓六腑に沁みて　泣ける　今回の選挙で　参政党がキャスティングボードを握って　日本人ファーストに舵を切ってもらいましょう,13,2025-07-08T08:37:56Z,2025-07-08T08:37:56Z,UCpZj4OrArAqZN1J_d_BE7pw
DU7TJEnlbsQ,,UgziH7tEwImZRok2G7h4AaABAg,False,@ピノ-u9f,"大山さん、当選間違いないよ！福島の皆さん、ヨロシクお願いします😊
参政党1択🎉",23,2025-07-08T08:36:05Z,2025-07-08T08:36:05Z,UCEUB0Eo0fLqXUZ1bH_7hWag
DU7TJEnlbsQ,,UgycfqxVmQr00AiQ7wh4AaABAg,False,@babelryo4203,20日は夫婦で参政党宛に投票デートします。,61,2025-07-08T08:32:58Z,2025-07-08T08:32:58Z,UCMK8ZKpyNZigfGhnzVYvmeA
,UgycfqxVmQr00AiQ7wh4AaABAg,UgycfqxVmQr00AiQ7wh4AaABAg.AKJHRmKaymSAKM6aZcyjNw,True,@あけみ金子,ステキ💖　羨ましいな😚,3,2025-07-09T10:55:55Z,2025-07-09T10:55:55Z,UCxFs6PEkv1n0PWAZAjEMO7w
,UgycfqxVmQr00AiQ7wh4AaABAg,UgycfqxVmQr00AiQ7wh4AaABAg.AKJHRmKaymSAKMDUpS72ms,True,@babelryo4203,​@@あけみ金子ありがとうございます！福島選挙区なので大山りさこさん、比例は参政党で投票します。,1,2025-07-09T11:56:10Z,2025-07-09T11:56:10Z,UCMK8ZKpyNZigfGhnzVYvmeA
,UgycfqxVmQr00AiQ7wh4AaABAg,UgycfqxVmQr00AiQ7wh4AaABAg.AKJHRmKaymSAKMF3AUEs2M,True,@あけみ金子,私は群馬なので、青木ひとみさん、比例区は松田学さんにしようと思ってます🎉　夫婦仲良くが一番ですね💕,2,2025-07-09T12:09:52Z,2025-07-09T12:09:52Z,UCxFs6PEkv1n0PWAZAjEMO7w
DU7TJEnlbsQ,,Ugx8NfBYmLfRwOvPyTl4AaABAg,False,@kuma6638,"国民負担税率が約半分なのはキツいです。
ソーラーパネルもどんどん敷き詰められて自然破壊。
自民党や立憲による利権政治を終わらせ農業や自然など、日本のあるべき姿を取り戻したいです。",4,2025-07-08T08:20:09Z,2025-07-08T08:20:09Z,UCAff3WA9I4IB2HwwD_OXpAA
DU7TJEnlbsQ,,UgxBwSH5pVa3RTXTQiZ4AaABAg,False,@洋子志賀,"行けなくて残念でした😢
今、YouTubeで視聴してます✨️
選挙戦、最後まで体調が守られますように🛐お祈りさせて頂きます❤",8,2025-07-08T08:07:09Z,2025-07-08T08:07:09Z,UCu_5cbSLsb54NFPcpxhfywg
DU7TJEnlbsQ,,Ugwkucqa_thWm7Dkkq94AaABAg,False,@user-dh7en6cy6rjiyusei,67歳の爺です!日本人です!福島県民です!大山さん一択です!参政党一択です!皆んなで日本を取り戻しましょう!,151,2025-07-08T08:06:05Z,2025-07-08T08:06:05Z,UCd0Exna6A0i3KJlQYoPTLSA
DU7TJEnlbsQ,,Ugxirp8qzoA3CdMhKJV4AaABAg,False,@おで-v8z,大山さんすごい👏分かりやすい演説でした　日本人が気がつけば絶対に変わる　絶対に投票に行きましょう,8,2025-07-08T07:49:05Z,2025-07-08T07:49:05Z,UCE15SHI2P7kgfBcJrAc2fuw
DU7TJEnlbsQ,,UgyG2t7m4EAuV-2ObFd4AaABAg,False,@中澤修-y8s,新潟県人です。70代です。期日前投票で、平井さんに入れてきました。田舎の年寄りも目覚めました。,58,2025-07-08T07:40:50Z,2025-07-08T07:40:50Z,UCG77BT2gD--bY9PzY3iFgmg
DU7TJEnlbsQ,,Ugxo6Jd7NUCnJKbaTtB4AaABAg,False,@澤村激,投票率８０％とかになったら自民党がもう選挙やりたくない！😭ってなるくらい惨敗すると思う😂,5,2025-07-08T07:36:14Z,2025-07-08T07:36:14Z,UCP1B-gj5n9oqFp5I6kExGCA
DU7TJEnlbsQ,,UgzNbTt847J-ogwqgNx4AaABAg,False,@T_roa,"神谷さん、声が枯れてるので心配ですね・・
お忙しいとは思いますが、お身体ご自愛ください🍊",9,2025-07-08T07:34:32Z,2025-07-08T07:34:32Z,UCtj2zCmzc_T5qQA63_gKclQ
DU7TJEnlbsQ,,UgzZ7X925v1ldenlE2p4AaABAg,False,@れもん-b4x8j,"最高だな👍️✨️参政党！
参政党のお陰で日本の未来に希望が持てます😊",13,2025-07-08T07:26:32Z,2025-07-08T07:26:32Z,UCnAU7CU7FUj3yDmG_S6Td_A
DU7TJEnlbsQ,,UgzEtxO5TvKSXTI4Vr94AaABAg,False,@midorichan-v1x,"神谷さんは、ここが踏ん張りどころではありますが、
スケジュールがハード過ぎて、倒れないか心配です。
参政党が政権取るためにも、体調管理と身辺警護を、
まわりの方がたも、しっかりサポートしてください！",26,2025-07-08T07:25:07Z,2025-07-08T07:25:07Z,UCRADEAEPcroNxUEAIJd7Sng
DU7TJEnlbsQ,,UgyH3EYEeOziw_wDbbZ4AaABAg,False,@endend-s7g,どうか頑張ってください！当日、参政党に入れに行きます‼︎,22,2025-07-08T07:19:17Z,2025-07-08T07:19:17Z,UCY34Q4JZVmrzV8vFp9ze8_w
DU7TJEnlbsQ,,Ugx_-o_o-aj6-SJlVkR4AaABAg,False,@Yumi-iy8kq,大山さん素晴らしい演説！そう！ヒーローは現れないみんなで変えるんだ！,9,2025-07-08T07:15:25Z,2025-07-08T07:15:25Z,UCKh3hIF9H8zXoofbGBTCS4A
DU7TJEnlbsQ,,UgyywmN5Wfu12fD_HSZ4AaABAg,False,@menomeeeery,"ただでさえ大変な思いをされた福島
国民が声あげて一緒に国を変えていきましょう！！！
大山さん神谷さん、素敵な演説でした！🟧",12,2025-07-08T07:14:01Z,2025-07-08T07:14:01Z,UC8rUrWZzPOgqREpew93Wgwg
DU7TJEnlbsQ,,UgzN97vQLg355qbT_Kx4AaABAg,False,@earthpeaceage,"福島凱旋調べてたけど
見つけられなかった🥹
遅かった‼️
でも参政党一択です‼️
親も応援してます‼️📣",8,2025-07-08T07:13:27Z,2025-07-08T07:13:27Z,UC0gS-fP7WDUYfJt6tcPUO5Q
DU7TJEnlbsQ,,UgwxhEB9cqzZ6EYBcwx4AaABAg,False,@Jptsyk,演説うまい、通るね彼女は,7,2025-07-08T07:10:58Z,2025-07-08T07:10:58Z,UCeDVHt0xB39eXBY1uSTbQTQ
DU7TJEnlbsQ,,UgwOANQgQOyCR_ffgfR4AaABAg,False,@ねこ-v4b9o,大山さんいいね！しっかりと自分の意思を伝える力がある！！,11,2025-07-08T07:08:12Z,2025-07-08T07:08:12Z,UCre1RCpzy8TcADkCo2tD5MQ
DU7TJEnlbsQ,,UgxDq_Od5fFu9QZJJyJ4AaABAg,False,@長押し君,"福島市の現地で演説会を見てきました。
有力議員は自民か立憲の土地柄で、いままでの新興政党ではあり得なかった熱気のこもった演説会でした。
参政党には、福島県の政界に風穴を開けてほしい！",30,2025-07-08T07:06:25Z,2025-07-08T07:06:25Z,UCEZkvFOhezvr2yY10onMvEQ
DU7TJEnlbsQ,,Ugw5UAKCYpNJuXOtc954AaABAg,False,@raremi-t9k,党首討論見て、つくづく無能な政治家達なんだなぁ〜って思いました。神谷さんの答弁がどれだけまともか思い知らされました!,3,2025-07-08T07:05:14Z,2025-07-08T07:05:14Z,UC-ifEDmDvGMr6mZL2ROrvZQ
DU7TJEnlbsQ,,UgwsDKxOtoW0zd26P3B4AaABAg,False,@マスタング分隊長,福島で参政党受かったら本当に国がひっくり返るよ！いけいけ！,73,2025-07-08T06:59:05Z,2025-07-08T06:59:05Z,UChnB0RXPC52ht81nKQv1i0A
DU7TJEnlbsQ,,UgwqVFmQE8MzrXlGLKd4AaABAg,False,@ayo7524,"参議院選選挙に行きましょう。
参政党　大山りさこ
１枚め投票用紙に書きましょう。
２枚めの投票用紙に
参政党と書きましょう。
または、比例候補者の名前をかきましょう。
比例投票はどちらかを選んでください。",3,2025-07-08T06:54:39Z,2025-07-08T06:54:39Z,UCFJMvTkE3SNt6RD5ij1p7yg
DU7TJEnlbsQ,,Ugz4YUOIM0Mv_KoArDd4AaABAg,False,@歩-m8s,配信ありがとうございます😌👍🍊🇯🇵✨✨✨,1,2025-07-08T06:46:40Z,2025-07-08T06:46:40Z,UCJjL2bli05ZVeMspOg2qabA
DU7TJEnlbsQ,,Ugw68JDuooHhNtLyWqp4AaABAg,False,@randy4267,"大山さん
是非、浜通り地区にも演説に
来て頂きたいです",8,2025-07-08T06:45:02Z,2025-07-08T06:45:02Z,UCYxpUn8zhQ0bRsfSx5eBMQg
DU7TJEnlbsQ,,Ugz10DiEcgPSRmeuimx4AaABAg,False,@iganoredsilk,大山さん、情熱ある演説で大変良いですね！,5,2025-07-08T06:32:05Z,2025-07-08T06:32:05Z,UCfGJDvQlvA25fzOWqDkl62A
DU7TJEnlbsQ,,UgyCYWQbG1UqCctK59x4AaABAg,False,@saunkuon,"東北人田舎者だと舐めるなよ
やるときはやる。大山さんが見本だ。皆さん、選挙に行きましょう。投票率あげましょう。",60,2025-07-08T06:28:22Z,2025-07-08T06:28:22Z,UCFZZdm0ibUIAJyYXAsky8Ng
DU7TJEnlbsQ,,UgwqfxaoHFwjAH4FiZx4AaABAg,False,@アイサン-q8o,"大山さん演説もどんどん良くなってます！🎉
気持ちの表れですよね",7,2025-07-08T06:23:47Z,2025-07-08T06:23:47Z,UCmUJQj611zkSWNbf9mphU3A
DU7TJEnlbsQ,,UgxrGaLnZP7yyJz_EL14AaABAg,False,@ryu-u8e,"大山さん素晴らしい。見るたびに演説の力強さ、説得力が爆上がりしてる。
当選しても驚かないし、納得感が高い。
福島県の皆様、大山りさこさんを宜しくお願いします🙇",3,2025-07-08T06:20:43Z,2025-07-08T06:20:43Z,UCexkkdXPJQshCYnAVFhrT3w
DU7TJEnlbsQ,,UgzT7HeJU3n94cAyo6B4AaABAg,False,@震天制空隊,"参政党、神谷宗幣、、、、、頑張ってるね。。街頭演説、プロの選対の常識では巨大政党マンモスに比べ、
参政党はどう考えても【　アリ　】だが、、、、、しかし、、、、【　奇跡が起きるのか？　】、、、、、、
これは巨大な【　　革命　　】だろう。",3,2025-07-08T06:19:30Z,2025-07-08T06:19:30Z,UC_iLX95TnGXTYZNV7wQbb4w
DU7TJEnlbsQ,,Ugwr-UFMkE5GVp1rD454AaABAg,False,@本日も晴天なり-m4g,期日前投票してきました😊大山さんにも参政党にも期待しています。日本人ファーストそして公約を一つでも多く実現してください。まだまだ道は遠いかもしれませんが、応援しています。,7,2025-07-08T06:14:27Z,2025-07-08T06:15:22Z,UCafM-jERE2fGCktSpTDxedg
DU7TJEnlbsQ,,Ugx7vkIZ7_if1cCb4F14AaABAg,False,@user-aun1965,敷金礼金制度良いですね、儲ける額位最初にとっちゃえば😆,4,2025-07-08T06:14:24Z,2025-07-08T06:15:44Z,UCHG7B_zlFDaNLQFPBXZtzaA
DU7TJEnlbsQ,,Ugx6ydoGVK8OwOShbbt4AaABAg,False,@17166-j,"良い歌、メロディー。
声もいい。マジかよ",3,2025-07-08T06:13:56Z,2025-07-08T06:13:56Z,UC9FMTIRHnS5Fg4siSC3ezow
DU7TJEnlbsQ,,UgzUFy1FCxC-mfAr_oN4AaABAg,False,@saunkuon,"大山さん　最高❤
参政党の皆さんは、本当に一人一人が人間として誇れる方達ばかりですね。是非大山さんには、国会議員になって欲しいです。応援しています。
頑張れ🎉",31,2025-07-08T06:11:09Z,2025-07-08T06:11:09Z,UCFZZdm0ibUIAJyYXAsky8Ng
DU7TJEnlbsQ,,UgzPlqo_Y6ZSA-xFXl14AaABAg,False,@アンチェル孝-k3b,"残念　音声が　次回は
大事な音声を　聴きやすく
頼む・・・・もったいないよ",0,2025-07-08T06:10:00Z,2025-07-08T06:10:00Z,UCXazH-YSeQ1hC-5zOt9587A
DU7TJEnlbsQ,,Ugw7knDTlrvsiICwBRd4AaABAg,False,@古川征敬,大山りさこさん　応援します。参政党に投票します。ミラクル！参政党全員当選55人！農家公務員化！ソーラー環境破壊！日本人ファースト！,8,2025-07-08T06:06:41Z,2025-07-08T06:07:47Z,UC1c-mOh4BuLbegj879BVJ0g
DU7TJEnlbsQ,,UgyIL1y2kyRToVJrjjp4AaABAg,False,@ちかちゃんcs,"大山りさこさん、頑張って下さい❤
とてもわかりやすく、熱い熱い言葉👏

大山さん、陣営の方も、皆さんお身体ご自愛の上、ご活躍下さい❤

私は今日は、安藤裕さんの選挙事務所に、ボランティア行ってきました。

京都より、大山さんのご活躍を、心よりお祈りしてます。

参政党一択🎉",5,2025-07-08T06:05:45Z,2025-07-08T06:05:45Z,UC_AA8lFHp1mEa4hEhuHS_hA
DU7TJEnlbsQ,,Ugybjk0mvWKakBBB8Y54AaABAg,False,@kkchMr-f6x,"福島の立候補者には当選してほしい
命を燃やしてる
その炎が消えないように支援したいと思える演説だった",14,2025-07-08T06:05:26Z,2025-07-08T06:05:26Z,UCYyijXXrNO2ngJ2E8ttbFGg
DU7TJEnlbsQ,,UgzYwboVBlUj-2LJ-A54AaABAg,False,@atsu1341,"先程は暑い中お疲れさまでした。
多分今回、日本動きますね。
応援します！期待してます！",6,2025-07-08T06:00:15Z,2025-07-08T06:00:15Z,UCFkhEMW62EPB3o-dgFNjuhg
DU7TJEnlbsQ,,UgwBmEKcUmFg6dxwyRd4AaABAg,False,@ayami0715,"色々な批判や圧力、脅迫など私達が普通に生活しているだけでは感じない沢山の恐怖感や不安感を抱えながら、矢面に立って闘って下さる参政党の皆さん本当にありがとうございます。

残り２週間まだまだ沢山の圧力がかかると思いますが、目覚めた国民で参政党を支えましょう！！！
参政党の議員さん、候補者さんの皆さん、またそのご家族をみんなで絶対守ろう！！！！
今こそ心を一つに💪💪💪💪🇯🇵🇯🇵🇯🇵",0,2025-07-08T05:59:54Z,2025-07-08T06:02:01Z,UCSboAoz8U7PeLQl_pba6MkQ
DU7TJEnlbsQ,,UgxYe9ord889TKALil14AaABAg,False,@かおりさん-o7w,"配信ありがとうございます🙇💕
毎日神谷代表の演説を聴くのが楽しみです😊
参政党一択です✨✨✨",5,2025-07-08T05:59:23Z,2025-07-08T05:59:23Z,UCRXUwgg0p6cH9MIuOBG0ifw
DU7TJEnlbsQ,,UgxZJcxy4hZ0yH-wyJV4AaABAg,False,@藤-v2l,"神谷代表！わざわざ福島まで有難うございます。少しお疲れのように感じます体が資本ですどうぞご自身の体労わって下さい。
1枚目  大山りさこ！
2枚目  参政党！ 
了解です！
大山さん当選目指し頑張れ！",7,2025-07-08T05:57:43Z,2025-07-08T05:57:43Z,UCFXDmeCYw5_8XGZYjSse85Q
DU7TJEnlbsQ,,UgyxxrPig3XpDUjh1tt4AaABAg,False,@ynakamaru2780,滅茶苦茶叩かれてますけど、AfDと比較したらたいしたことないですね。参政党のピークはこの参院選ではないですよね？注目度がまだまだ足りないよ！！,5,2025-07-08T05:46:38Z,2025-07-08T05:46:38Z,UCY8we9OVDdWqng-YQpHvRaw
DU7TJEnlbsQ,,UgzPwUSgwAzq5GLs3gt4AaABAg,False,@mariean00nemarie,他県民ですが福島のみなさま大山さんをよろしくお願いします,10,2025-07-08T05:38:29Z,2025-07-08T05:38:29Z,UCP_aY2E2FHaLg6WMQvu033Q
DU7TJEnlbsQ,,UgyiioqJMihTcenhyYl4AaABAg,False,@たかたか-n3k1u,"自民、公民、立憲が政権取ると、
今以上に税金上がりますよ。
そんなこと、耐えられますか？

参政党しかない。
まだ、経験値はないとしても、
野党第一党になってほしい！
国民が参政党を育てましょう‼️",10,2025-07-08T05:37:06Z,2025-07-08T05:37:06Z,UCyvMHNg7caVFNWwcpFAt3ew
DU7TJEnlbsQ,,UgyuLXmmJNMdRVgQAYl4AaABAg,False,@ぷちふる,"福島県民として来てくれたのうれしいいいいい
公約実現してくれよ......",3,2025-07-08T05:35:25Z,2025-07-08T05:35:25Z,UCkE3KoQZOpJEIVP4iteYeXg
DU7TJEnlbsQ,,UgypjdNg-8Uyp-TJKtd4AaABAg,False,@sk-of1wj,大山さん気合い入ってていい👍,3,2025-07-08T05:35:18Z,2025-07-08T05:35:18Z,UCa-UA1cbuoUbsCJQM-ankgA
DU7TJEnlbsQ,,Ugysf5uclgFjXAsoml54AaABAg,False,@インターネットのgm,"福島の参政党立候補者はこの女の人なんだーって感じで名前だけ知ってたけど喋りが力強くて頼もしい人だな
福島はメガソーラーあるからなんとかしてくれ",33,2025-07-08T05:32:30Z,2025-07-08T05:32:30Z,UC79ILXyG4Nob2FIis46NTBA
DU7TJEnlbsQ,,Ugz4zpfFOFbrF62eaBF4AaABAg,False,@WS-lq2uy,神谷代表のボディガード増やしてほしい🙏,14,2025-07-08T05:26:04Z,2025-07-08T05:26:04Z,UCfelH-LhHajpKdbs2IA_cKw
DU7TJEnlbsQ,,UgzDuQFdL8uD6K6SnBB4AaABAg,False,@NY-zq2vr,大山さんの勇気、素晴らしいです。本当にありがとうございます！,3,2025-07-08T05:23:23Z,2025-07-08T05:23:23Z,UC7Zp2Funkh-dmIzJNf-HDyA
DU7TJEnlbsQ,,UgymIAvuyaL0jajEhpN4AaABAg,False,@ui_pappy,"参政党に出会って、日本が好きで日本人であることを誇りに思ってたんだと気付きました。国旗の件は許せません😢
なんとしても日本を正しましょう！！！",7,2025-07-08T05:22:24Z,2025-07-08T05:22:44Z,UCwJlWUzc3amSMfE_fVf6s6Q
DU7TJEnlbsQ,,UgyNcBTy_ecUC_B5YpJ4AaABAg,False,@comy.loy0502,この期間中の演説配信見るのが日課です。大山さん素晴らしい候補者の方ですね。参政党、代表だけ熱いのかと思ったら全国にこんなに強い候補者がいるんですね。今回の選挙絶対議席伸ばしましょう！日本腐ってないことを証明しましょう！！,1,2025-07-08T05:21:29Z,2025-07-08T05:21:29Z,UC4MLY_AMBy8cUhbxNZBvg-Q
DU7TJEnlbsQ,,UgysQwD32GM1GFWwAD54AaABAg,False,@shogo4914,"めっちゃいい演説してる。
他県だけど大山さんに投票したい。",7,2025-07-08T05:20:43Z,2025-07-08T05:20:43Z,UCevXJg2c2mfLyUYNC_RC_8A
DU7TJEnlbsQ,,UgxmWIVEHvFjr9vlzLR4AaABAg,False,@ui_pappy,"大山さん素敵ですね✨
神谷さん連日お疲れ様です！
福島の皆さまよろしくお願いします！！🙏",3,2025-07-08T05:20:02Z,2025-07-08T05:20:02Z,UCwJlWUzc3amSMfE_fVf6s6Q
DU7TJEnlbsQ,,Ugy8Rl-6ebp_z9fp6o14AaABAg,False,@sss-x7n,"大山りさこさん、素晴らしい演説です👏愛知県民ですが、とても響きました！
福島の皆さん、大山さんを必ず勝たせてください！応援しています！
この選挙、みんなでチカラ合わせて大勝しましょう💪",8,2025-07-08T05:16:06Z,2025-07-08T05:16:06Z,UCWWzdBR4SquK7JBJTVzrvag
DU7TJEnlbsQ,,Ugyw4E_VJs0-JnsV-gp4AaABAg,False,@O_tas,"福島県民です。
もう自民党政権を終わらせましょう。
私は今年29歳になりますが、
お恥ずかしながら27歳まで政治に興味が無く
選挙にも行った事がない人間でした。
そこまで不自由を感じておらず、
安倍さんや菅さんの頃は楽しかった思い出です。
ただ、岸田や石田政権になってから、政治に関して
不信感を抱く様になり、このままでは危ないと
直感的に感じました。
そして、色々自分なりに本やYouTubeで政治を勉強し、
それらを通して今回、参政党に入れる事にしました。
正直、全てを賛同している訳ではないですが、
このまま自民党政権が続けば
我々の暮らしは今よりもっと悪くなる一方です。
貧富の格差、増税、手取り減待った無しです。
ここまで長々と書いてしまいましたが、
選挙区では大山りさこ様
比例区ではあんどう裕様
に入れようと思います。
私はこれから未来を担う若者や
中年層、お年寄りの方々全員に対し、
暮らしをより豊かに、安全に、楽しく
この素晴らしい日本という国をもっと好きになってほしいと願っています。
どうか、このコメントが少しでも福島県民の皆様に届く事を願っております。",15,2025-07-08T05:13:23Z,2025-07-08T05:13:23Z,UCah5kaaG1L9hIND9G6QoauA
DU7TJEnlbsQ,,Ugyb5xJRZAgvW37dPox4AaABAg,False,@soulsurfer7778,世界で起きている、特に欧州で起きている、反グローバリズムを掲げる政党の勃興が、日本でもとうとう始まったということでしょうか。その「勃興」に点火したのは、まさしく、トランプ大統領であります。世界では、既に政権を取った反グローバリズムを掲げる政党もありますが、次の選挙で政権を取るところまできている政党が幾つかあります。この親トランプ現象が、世界へ飛び火すれば、世界がグローバリズム主義に席巻された忌まわしい時代も終焉します。日本も、やがて親トランプ政党が政権を取る日が着々と近づいて来ています。,0,2025-07-08T05:13:10Z,2025-07-08T05:13:10Z,UCkvWW839En-Yvgy6OgQhBEQ
DU7TJEnlbsQ,,UgyIIBh18v11jUxMcaR4AaABAg,False,@user-jw1qu9yn5f,"皆さん
日本人ファーストの為に日本国の為にありがとうございます",2,2025-07-08T05:11:33Z,2025-07-08T05:11:33Z,UCq49yLEWcz8Zr11N7h_T0gg
DU7TJEnlbsQ,,UgwLkoTvjEwWS7DDc1N4AaABAg,False,@yutton6874,100年記念塔も釧路のメガソーラーも悔しい、動物が、世界一の自然が,3,2025-07-08T05:09:50Z,2025-07-08T05:12:21Z,UCAIdGXkFqAtx9tprmgiAVew
