videoId,parentId,commentId,isReply,authorDisplayName,text,likeCount,publishedAt,updatedAt,authorChannelId
DU7TJEnlbsQ,,UgynsDzsQUeFlYGEWyZ4AaABAg,False,@もちもち-x1l,"大山りさこさんイイ！✨✨✨

地域ごとに応援のカラー、候補者のカラーが違い見応えあります。
選挙演説ほぼみたこと無かったが、こんなに候補者達の演説を聞いてみたいと思った選挙は初めて。
参政党神谷さんの演説を見てからです。
日本を変えよう、世界を変えよう！",93,2025-07-08T02:55:47Z,2025-07-08T02:55:47Z,UCxA8MPPUkq5rKkAn_iKurLg
DU7TJEnlbsQ,,UgwoKXHgF8zhHTUtzxB4AaABAg,False,@nocultwakeup,No Sanseito,0,2025-07-08T02:54:33Z,2025-07-08T03:01:02Z,UCKBc0CNGgHaoT5y8dBVbaeg
DU7TJEnlbsQ,,UgyK_KLZNWRr_WZc1Il4AaABAg,False,@kakesonn478,"大山さんの演説今までで一番心打たれました！
ぜひ頑張ってほしいです！",109,2025-07-08T02:54:29Z,2025-07-08T02:54:29Z,UCaJjr14qzcMTEy9ZxkgKSQQ
DU7TJEnlbsQ,,UgzhU5ytBz5sad3xYL14AaABAg,False,@shinobu_kamo,大山さん素晴らしい演説！吉川さんに負けて無いです…,65,2025-07-08T02:54:12Z,2025-07-08T02:54:12Z,UCK6qaf22aBFQwP1AkLwWUfQ
DU7TJEnlbsQ,,Ugy5mxW_xqeNN_jzxgZ4AaABAg,False,@さとみ-m9c,1年働いて半年タダ働き‼️そんな馬鹿な話し無いです‼️,362,2025-07-08T02:52:12Z,2025-07-08T02:52:12Z,UCzzedwk3n1vMQGJ8Icv4rfg
DU7TJEnlbsQ,,UgzptDQNeFbuK1rtKtt4AaABAg,False,@wowmah,マルチ商法、参政党。創憲の為の政治ビジネス。,0,2025-07-08T02:51:47Z,2025-07-08T02:51:47Z,UCm4OgbY--1ydMBiz1_gtF2Q
,UgzptDQNeFbuK1rtKtt4AaABAg,UgzptDQNeFbuK1rtKtt4AaABAg.AKIfOqaRMR_AKIgQWttUJP,True,@meet-hd2ce,"れいわ支持者さん
毎度毎度、お疲れ様です。",27,2025-07-08T03:00:45Z,2025-07-08T03:00:45Z,UCdNf3P55cr3eURcUthNxh-Q
,UgzptDQNeFbuK1rtKtt4AaABAg,UgzptDQNeFbuK1rtKtt4AaABAg.AKIfOqaRMR_AKIhPiFkB07,True,@hhii32,わざわざ観にきて頂いてありがとうございます。お互い頑張りましょう。,21,2025-07-08T03:09:23Z,2025-07-08T03:09:23Z,UC_EXuBP12M-ecprLNoPOtDw
,UgzptDQNeFbuK1rtKtt4AaABAg,UgzptDQNeFbuK1rtKtt4AaABAg.AKIfOqaRMR_AKIhaYNtWYN,True,@希望匿名-j1u,参政党に注目してくれてありがとうございます！あなたの支持政党も飛躍しますように。,4,2025-07-08T03:11:00Z,2025-07-08T03:11:00Z,UCBdpWEjSLqXj4Nbh1UpR00g
,UgzptDQNeFbuK1rtKtt4AaABAg,UgzptDQNeFbuK1rtKtt4AaABAg.AKIfOqaRMR_AKIir9mQvyX,True,@KK-bm2dm,れいわは凄いよな、くしぶち中国まりこと山本朝鮮太郎のハイブリッド政党,2,2025-07-08T03:22:00Z,2025-07-08T03:22:00Z,UC_ZddWR1Ha0ZLtlM10iQ1cA
,UgzptDQNeFbuK1rtKtt4AaABAg,UgzptDQNeFbuK1rtKtt4AaABAg.AKIfOqaRMR_AKIjR53AVHe,True,@財政法上日銀の保有国,とるに足らん問題だな,5,2025-07-08T03:27:03Z,2025-07-08T03:27:03Z,UCbGqm_lqdpjVK17yL7uEd1A
DU7TJEnlbsQ,,UgyP-l7fBDgm5ZQY5mF4AaABAg,False,@野良犬募金,橙の焔ラストに流れる歌です😊,43,2025-07-08T02:50:45Z,2025-07-08T02:50:45Z,UCIjdaF9KQ1UzjgDbPJk9vnw
DU7TJEnlbsQ,,Ugwp86p-vHn6Ub-RW_94AaABAg,False,@toshiakeykobayashi8338,福島のみなさんよろしく頼みます。日本を取り戻しに行きましょう‼️,144,2025-07-08T02:50:07Z,2025-07-08T02:50:07Z,UCQ-IPUxMFy_SOaan8QOrcmg
DU7TJEnlbsQ,,UgzYaETqLba-ePtu4KB4AaABAg,False,@aaa-q3r8i,"！！！！！２５パーセントおめでとう！！！！！！
！！！！！ガマガエル石破・ピストン赤沢！！！！
！アポなし訪問の結果、１パーセント上がった！！",14,2025-07-08T02:49:36Z,2025-07-08T02:49:36Z,UCytDoAhhNQwwVPTFQnmon1w
DU7TJEnlbsQ,,UgyNa9pj8lzxyMTWLlR4AaABAg,False,@Fuliesta1048,ワクワクする福島を大山さんに託します。,280,2025-07-08T02:48:49Z,2025-07-08T02:48:49Z,UCIbsqsG-bGEQtnQU5ozSg3Q
DU7TJEnlbsQ,,UgwSK9isUjj-LJu45yt4AaABAg,False,@シュン殿視聴用,その通り、あのソーラーパネル撤去してよ。景観が台無しです。,507,2025-07-08T02:48:38Z,2025-07-08T02:48:38Z,UCtVzgsNmLR0CXBm6IOHLtcQ
,UgwSK9isUjj-LJu45yt4AaABAg,UgwSK9isUjj-LJu45yt4AaABAg.AKIf1n_WWLxAKItsdzojyo,True,@ngknt300,いつか撤去して我々日本人の手で植樹をしましょう。あの時はごめんね。これからはずっと守るからねっと。大丈夫日本は変わります！,47,2025-07-08T04:58:20Z,2025-07-08T04:58:20Z,UCcxSQoO8S2UARBX_--jA5RA
DU7TJEnlbsQ,,UgwbhJolP_YUB6NcYO14AaABAg,False,@JapanTravelGuidesunny,福島の方🟠1枚目「おおやまりさこ」　2枚目「参政党」　神谷さんの名前や余計なこと書くと無効票になります。書き方気をつけて🟠頑張ろう福島！,219,2025-07-08T02:48:21Z,2025-07-08T02:48:21Z,UC-MOaOh_wcK7ANw2KqYuecQ
,UgwbhJolP_YUB6NcYO14AaABAg,UgwbhJolP_YUB6NcYO14AaABAg.AKIf-iMZ25TAKIhSoYzlkt,True,@タヌコ-j3k,比例は日本保守に入れてもいっすか？,6,2025-07-08T03:09:48Z,2025-07-08T03:09:48Z,UCDNWydy4FPB7KgmYoiMh6fA
,UgwbhJolP_YUB6NcYO14AaABAg,UgwbhJolP_YUB6NcYO14AaABAg.AKIf-iMZ25TAKIi3hVcxvk,True,@エマっくま,"@@タヌコ-j3k
神谷さんも、参政党じゃなくてもいいから投票に行って欲しい、出来れば参政党に入れて欲しいって言ってましたので、おkですよ🙆‍♀️",19,2025-07-08T03:15:07Z,2025-07-08T03:15:07Z,UCcaraxngtYGp_cL-Vn3D_sw
,UgwbhJolP_YUB6NcYO14AaABAg,UgwbhJolP_YUB6NcYO14AaABAg.AKIf-iMZ25TAKIiMaN9LYL,True,@佐方昭文,"期日前投票に行き、大阪選挙区に宮出ちさとさん、比例区に梅村みずほさんに一票入れました。
自公立憲維新共産を潰しましょう。😊",22,2025-07-08T03:17:42Z,2025-07-08T03:17:42Z,UCeYfmNWbTrgZFVRUludMpJw
,UgwbhJolP_YUB6NcYO14AaABAg,UgwbhJolP_YUB6NcYO14AaABAg.AKIf-iMZ25TAKIk5p7GgX5,True,@JapanTravelGuidesunny,@@タヌコ-j3kあなたのよろしいように。,6,2025-07-08T03:32:53Z,2025-07-08T03:32:53Z,UC-MOaOh_wcK7ANw2KqYuecQ
,UgwbhJolP_YUB6NcYO14AaABAg,UgwbhJolP_YUB6NcYO14AaABAg.AKIf-iMZ25TAKIp6oMNbqf,True,@sonya-bibi,「神谷宗幣は立候補してません。神谷宗幣と書かないでください。」そうなの、初心者あるあるで、思わず書いてしまう人多いと思うよ。,11,2025-07-08T04:16:42Z,2025-07-08T04:16:42Z,UCwyB2VEDcigc0RBGkdl9kcw
,UgwbhJolP_YUB6NcYO14AaABAg,UgwbhJolP_YUB6NcYO14AaABAg.AKIf-iMZ25TAKIu_Vs22OS,True,@LP041ノヴァ,"ありがとう！
書き方参考今まで投票しなかった人には助かりますね👍‼️
皆で生きずらい日本から生きやすい日本へ帰還しましょう、もう歪んだ思いからも脱出しょうぜ‼️と思う私です😆",8,2025-07-08T05:04:27Z,2025-07-08T05:04:27Z,UCDRtNybmM62DCJJ-_2WtJFA
,UgwbhJolP_YUB6NcYO14AaABAg,UgwbhJolP_YUB6NcYO14AaABAg.AKIf-iMZ25TAKJIeE7g4Aw,True,@fxryu-chan6378,2枚目の比例代表に書くのは、参政党の比例代表の10名の中から選びましょう。,5,2025-07-08T08:43:33Z,2025-07-08T08:43:33Z,UC6s1umOLR3EUdg8NKAY7LmA
,UgwbhJolP_YUB6NcYO14AaABAg,UgwbhJolP_YUB6NcYO14AaABAg.AKIf-iMZ25TAKJInhh3KVq,True,@fxryu-chan6378,"​@@LP041ノヴァ
毎度ですが福岡でも関東でも不正と疑わしきが横行しています。可能ならボールペン持参で当日投票がベストではあります。",1,2025-07-08T08:44:51Z,2025-07-08T08:44:51Z,UC6s1umOLR3EUdg8NKAY7LmA
,UgwbhJolP_YUB6NcYO14AaABAg,UgwbhJolP_YUB6NcYO14AaABAg.AKIf-iMZ25TAKTtZy1djqY,True,@kotaro888,​@@タヌコ-j3kもちろんだよ！とりあえず、自公政権終わらせないと日本人の人権終わるから組織票持ってないところに入れてくれるなら大歓迎よ。,1,2025-07-12T11:27:17Z,2025-07-12T11:27:17Z,UCnB1MITh8So6kMgWlDFKa7g
DU7TJEnlbsQ,,Ugw06pFpuiZmQoqYecF4AaABAg,False,@asa01053,登録者38.2万人,86,2025-07-08T02:48:16Z,2025-07-08T02:48:16Z,UC-ECzVZd6nBJ5exUdoZ1t7w
DU7TJEnlbsQ,,Ugy5e4ma784d_HO50wF4AaABAg,False,@nohr1154,登録者数、れいわ(そもそも令和などという元号を左翼が使う姑息さよ)に並びました！余裕で抜き去っていくでしょう🇯🇵🇯🇵🇯🇵🇯🇵🧡🧡🧡🧡,4,2025-07-08T02:47:50Z,2025-07-08T02:47:50Z,UCJ7dZJRda9CMtyPMqNGoieg
DU7TJEnlbsQ,,Ugz4zuSotMIzGLJkTfV4AaABAg,False,@白ひげジジ,吉野になっ！,4,2025-07-08T02:47:42Z,2025-07-08T02:47:42Z,UCr0IgmEe3u2yke6-qgq7QlQ
DU7TJEnlbsQ,,UgyRSSmh4A7lhpZ1zZp4AaABAg,False,@whitemoon112,"期日前は不正とか色々と疑わしい面もあるので当日に参政党に投票します.ᐟ.ᐟ.ᐟ
投票率80%が実現しますように✨✨",119,2025-07-08T02:45:58Z,2025-07-08T02:46:58Z,UCE-0gp4XKo8WVKMoZlw3TkQ
DU7TJEnlbsQ,,Ugw5BMjtAtGLjnqAm9F4AaABAg,False,@うめちゃん-c8q,この曲も歌詞の原案を書いたのは神谷さん,148,2025-07-08T02:45:38Z,2025-07-08T02:45:38Z,UC8hwYSQtKKg25_Et06mpcWw
DU7TJEnlbsQ,,Ugyigdo8LW8ndvD8JQF4AaABAg,False,@エマっくま,大山さん言うべきこと的確に全部言ってくれて最高(*｀ω´)b頑張れ👍,84,2025-07-08T02:45:27Z,2025-07-08T02:45:27Z,UCcaraxngtYGp_cL-Vn3D_sw
DU7TJEnlbsQ,,Ugw5pLMkqoeGHQpe1m94AaABAg,False,@adas7783,"炭素削減型火力発電もいいと思うよ。
日本人ファーストで、一次産業盛り上げよう",47,2025-07-08T02:45:07Z,2025-07-08T02:45:07Z,UCyMNbEACwg2dsHM0CRHiYDw
DU7TJEnlbsQ,,Ugwkqwg03bRKPJGFKwd4AaABAg,False,@うめちゃん-c8q,ヒーローは現れない,17,2025-07-08T02:44:38Z,2025-07-08T02:44:38Z,UC8hwYSQtKKg25_Et06mpcWw
DU7TJEnlbsQ,,UgwhGX19OGzBPnw8LzB4AaABAg,False,@やんごとなき-r5j,🟠凄まじい勢いでチャンネル登録者数が増えてる🟠,95,2025-07-08T02:43:26Z,2025-07-08T02:43:26Z,UC1Vv7v_KVkDlf_ayPnMj9UQ
,UgwhGX19OGzBPnw8LzB4AaABAg,UgwhGX19OGzBPnw8LzB4AaABAg.AKIeRdBFsJRAKIehTBB5Nj,True,@中村-n4k,れいわを抜いた！,19,2025-07-08T02:45:44Z,2025-07-08T02:45:44Z,UC4QATQvR7LIFF0BHL4a0Wug
,UgwhGX19OGzBPnw8LzB4AaABAg,UgwhGX19OGzBPnw8LzB4AaABAg.AKIeRdBFsJRAKIf_jWtmZ1,True,@みどり-z4y,嬉しい悲鳴ですが、油断禁物ですね。,22,2025-07-08T02:53:25Z,2025-07-08T02:53:25Z,UC_5b_pPQchbl5938c27RoAw
,UgwhGX19OGzBPnw8LzB4AaABAg,UgwhGX19OGzBPnw8LzB4AaABAg.AKIeRdBFsJRAKIfwrEqBB6,True,@中村-n4k,"@@みどり-z4y
そうですね。
ボロを出さないように気をつけていただきたいです。",10,2025-07-08T02:56:34Z,2025-07-08T02:56:34Z,UC4QATQvR7LIFF0BHL4a0Wug
DU7TJEnlbsQ,,UgxcYAHj-k6miq2GN554AaABAg,False,@umoland,"この国の腐った政治を、
終わらせにきた！(ドンッ！)",143,2025-07-08T02:43:02Z,2025-07-08T02:43:02Z,UCIE-RNhohkRJOFHkTQJ30TQ
,UgxcYAHj-k6miq2GN554AaABAg,UgxcYAHj-k6miq2GN554AaABAg.AKIeOhLZHNiAKIh6LR9W92,True,@にゃんじゃじゃん,"シャアアアアアンクス
我々一人一人がシャンクスになろう！",8,2025-07-08T03:06:44Z,2025-07-08T03:06:44Z,UCvs3r9bLj6incKP4wTJoPzQ
DU7TJEnlbsQ,,Ugz-dCaP9q59GO3xqbB4AaABAg,False,@nocultwakeup,メロンパンとうどんの差し入れに行きます!,4,2025-07-08T02:42:31Z,2025-07-08T02:42:31Z,UCKBc0CNGgHaoT5y8dBVbaeg
,Ugz-dCaP9q59GO3xqbB4AaABAg,Ugz-dCaP9q59GO3xqbB4AaABAg.AKIeKuAnTooAKIfPebLz4u,True,@meet-hd2ce,"メロンパンは日本誠真会の吉野さんですよ😂😂😂
間違えないでね😊",25,2025-07-08T02:51:54Z,2025-07-08T02:51:54Z,UCdNf3P55cr3eURcUthNxh-Q
,Ugz-dCaP9q59GO3xqbB4AaABAg,Ugz-dCaP9q59GO3xqbB4AaABAg.AKIeKuAnTooAKIfYJPrglP,True,@渡邉佳枝-q6u,行き先間違えてますよ。,20,2025-07-08T02:53:05Z,2025-07-08T02:53:05Z,UCY75Ffn9of4YyL5Pvs3QHTQ
,Ugz-dCaP9q59GO3xqbB4AaABAg,Ugz-dCaP9q59GO3xqbB4AaABAg.AKIeKuAnTooAKIhoa7y94T,True,@user_yuu,参政党のYouTube収益、拡大にご協力ありがとうございます🇯🇵🧡,11,2025-07-08T03:12:55Z,2025-07-08T03:12:55Z,UC7kn16cuBeZj8hZ6vmuJB9Q
,Ugz-dCaP9q59GO3xqbB4AaABAg,Ugz-dCaP9q59GO3xqbB4AaABAg.AKIeKuAnTooAKIih7ow30I,True,@KK-bm2dm,メロンパンは日本メロン会の党首切腹メロンパンマンに届けてください,5,2025-07-08T03:20:38Z,2025-07-08T03:20:38Z,UC_ZddWR1Ha0ZLtlM10iQ1cA
DV7Up35Q_T4,,Ugwv42VBifcMuG22bnR4AaABAg,False,@タチャンカ-j9n,24:27,0,2025-08-12T08:42:59Z,2025-08-12T08:42:59Z,UCWvsBH5GW6d08OQWa6nIT7A
DV7Up35Q_T4,,UgzLL9pk3ZnLwdEtEkx4AaABAg,False,@001abcdef,岩手の皆さん、まだまだこれからです！参政党支持者の皆さんお疲れ様でした😊そして、ありがとー,0,2025-07-21T05:20:29Z,2025-07-21T05:20:29Z,UCfavFW2KjXcz31tflUD7RQg
DV7Up35Q_T4,,Ugw5kLd3swgUr1kYDDd4AaABAg,False,@鳳凰-c4l7u,今日朝から宮城県から用事で岩手北上に行ってました。昼前に交差点で及川さんが居て手を振りました。岩手県民の方々、及川さん宜しくお願いいたします。,0,2025-07-19T05:24:08Z,2025-07-19T05:24:08Z,UCrSL_KVga8-OeDUrA6Dyzig
DV7Up35Q_T4,,Ugzighf1qb4yFuK9g0B4AaABAg,False,@山田太郎-e3m8m,"岩手北上市住みですが神谷さん良く岩手へ来てくれてありがとうございます!

1枚目、2枚目は及川さん、参政党と信じて投票します！

頑張れ参政党‼️",0,2025-07-19T02:39:27Z,2025-07-19T02:39:27Z,UCbp_Y0NUSNQQzLNyvqSRyVg
DV7Up35Q_T4,,UgxOyBcOe9XZaicShG94AaABAg,False,@フローネ-t5l,投票します。,1,2025-07-18T07:55:25Z,2025-07-18T07:55:25Z,UC86G81ngNwQnAm4z96vhuow
DV7Up35Q_T4,,UgwUaz58mQFRbDyCYht4AaABAg,False,@shirosaku7270,"岩手県民です。
恥ずかしながら30代で初めて選挙に行きました。初めてです、こんなに政治に関して考えたのは。
もちろん参政党に入れました！
及川さんも声を上げてくれてありがとうございます。全力で応援しています！！
神谷さんも、体調悪い中ありがとうございました！応援しています！",3,2025-07-18T04:13:01Z,2025-07-18T04:13:01Z,UCF_GKIkaAnYgsJUh0VA7U_A
DV7Up35Q_T4,,UgxWOuSQvgTSiSnbtnR4AaABAg,False,@bbbddd5277,全国の日本人よ！！目覚めよーー！！🇯🇵🇯🇵🇯🇵,1,2025-07-16T04:01:18Z,2025-07-16T04:01:18Z,UCCn0ibfqZs7OZG7FumOssmw
DV7Up35Q_T4,,UgzjXOaptXSpNfZ4YuN4AaABAg,False,@やじまとみ,神奈川県民です。桜木町での及川さんの演説に涙しました。こちらの演説でもとても気持ちが伝わってきました。岩手にいる友達に参政党・及川さんのことをお伝えしました。及川たいすけ、頑張れ！,1,2025-07-14T15:59:21Z,2025-07-14T15:59:21Z,UCQv39rJrTQcOL1oNJkp-s1Q
DV7Up35Q_T4,,UgzmfAfR3eweqa-Jxz14AaABAg,False,@MG-pg8yo,"岩手県民ですが今まで自民か立憲どちらかしか候補者がいなかった為もどかしい1票ばかり入れてきました
結果犯罪犯したりエロ議員出たり貴重な1票を無駄にされ非常に悔しいと言うか県民として恥ずかしい思いしかしていません

今回心からの楽しみな、期待を込めた1票を投じることが出来ます
参政党、及川さんに1票投じます",3,2025-07-14T09:27:40Z,2025-07-14T09:27:40Z,UCfm8z8DPQYPCN-7kirY_qwg
DV7Up35Q_T4,,UgyPo6JjkmMToSpsT-N4AaABAg,False,@滝川宗十郎,福岡演説で神谷代表が仰っていた。国会議員の戸籍を調べる。必ずやるには、感動しました。日本を利権で売る議員、財務省は要らない。,1,2025-07-13T14:06:20Z,2025-07-13T14:06:20Z,UCCUkSmDLb6jDeLojIpdKMJg
DV7Up35Q_T4,,UgyIfScnNqRXKWMcXr14AaABAg,False,@pinonoir1237,"他の都道府県での街頭演説に比べたら、聴衆の盛り上がりに欠けるように感じますね。
さすが、昔から小沢一郎に洗脳されていたからのか、別の意味で保守的な思想から抜け出せない県民性なのか…

俺も閉鎖的な県民性に嫌気が差し、故郷岩手を捨てた人間だけど、本当は岩手が好きなんだ。

だから、岩手県民は目覚めよう。
古いしがらみを脱ぎ捨て、自分たちの力で新しい岩手県を手に入れよう！というか、本来の岩手県を取り戻そうぜ。",1,2025-07-13T13:34:35Z,2025-07-13T13:35:23Z,UCDYrWaTF8IcIwUgSZcz5rew
DV7Up35Q_T4,,UgyAMUe3rnvYwOfqJTV4AaABAg,False,@nyoha_ositsuco,岩手県民です。演説に仕事の都合で行けなくてとても悔しいです！応援してます！今回も参政党に投票します！,2,2025-07-12T04:51:37Z,2025-07-12T04:51:37Z,UCmS6LZ-Mjz6ySiK7moOQJUQ
DV7Up35Q_T4,,Ugy8aaQ6PZz1HqSjBTl4AaABAg,False,@マロンクリーム,親にとっては新聞が正義。ほら、デマだって、と聞く耳を持ってくれない。説明しようとしてもそんな難しいことは聞きたくない、と言われます。ボリュームゾーンのまさに団塊の世代です。そして、選挙にはしっかり行くのです…及川さん、応援しています!,2,2025-07-11T23:45:56Z,2025-07-11T23:45:56Z,UCWvCiMT4QFauPY8LORnj0Iw
DV7Up35Q_T4,,UgyPpsJ36d-TGQ9MEGF4AaABAg,False,@ちびくろたん,うちの親も赤字でずーっとやってます。そのとおりです。プライドでやってます。先祖に申し訳ないからって頑張ってます。周りの田んぼはどんどんなくなってしまって、作る人が年々減ってるのが現実です。絶対参政党に、投票します‼️応援してます‼️わざと三連休の中日にしようが、絶対投票します‼️,3,2025-07-11T20:25:27Z,2025-07-11T20:33:17Z,UCy8k55o-Z1HCYPbSKyJsFag
DV7Up35Q_T4,,Ugx7JiIDrCFiUPHOZzl4AaABAg,False,@koba-koba-koba,普通の人がお金や地盤がなくても政治家になれるのが参政党,1,2025-07-11T18:51:18Z,2025-07-11T18:51:18Z,UC18o65kuU_SUVLkpNgJHx3Q
DV7Up35Q_T4,,UgwDQAPbBqiDCLFj1194AaABAg,False,@ネムネム-j9y,米は5キロ1600円から2000円それでないと低所得ではくらせない！家賃も光熱費もある,1,2025-07-11T01:47:41Z,2025-07-11T01:47:41Z,UC_4t-lfw5f0XymV4n3JyKkg
DV7Up35Q_T4,,UgyVNo4K2RnvkhuZmF94AaABAg,False,@勇也菊池,"参政党一択です。
家族一同、心から応援してます！",2,2025-07-10T03:05:09Z,2025-07-10T03:05:09Z,UChIcRfgkpnx_k6T9rtPz6pQ
DV7Up35Q_T4,,Ugy8bdCuPyaNcrGuqox4AaABAg,False,@keiko5116,及川さんの言葉に涙が出ました。素晴らしすぎです。,1,2025-07-10T02:19:26Z,2025-07-10T02:19:26Z,UCl5KBMGOGb2L1AHgRRMDuvQ
DV7Up35Q_T4,,UgxbaLYbF6JN5XL9mKV4AaABAg,False,@フクちゃん-i6j,"参政党は日本人ファーストではありません。
今の憲法を破壊し日本人をだまし犠牲にしてでも国を最優先、軍国主義を進める危険な政党です。
参政党区議が自民党と一緒に会派を組んで神宮外苑の森を破壊してます。",0,2025-07-09T22:31:34Z,2025-07-09T22:31:34Z,UCfmJSHIOyX4kU5ivrnmtAGA
,UgxbaLYbF6JN5XL9mKV4AaABAg,UgxbaLYbF6JN5XL9mKV4AaABAg.AKNMCfrY5j6AKpw-QMc3rR,True,@タチャンカ-j9n,陰謀論です,0,2025-07-21T10:11:03Z,2025-07-21T10:11:03Z,UCWvsBH5GW6d08OQWa6nIT7A
DV7Up35Q_T4,,Ugwy7W39aYlkQIJYSIR4AaABAg,False,@ToyHikoka,"参政党の皆様、お疲れ様です。投票先は、参政党一択です。
（参政党の皆様：議員の方、立候補されている方だけでなく、選挙活動を支えている党員、ボランティアの方、ご家族全員です）",1,2025-07-09T14:24:19Z,2025-07-09T14:24:19Z,UCv1qQORXpQ-7Esl3T3XvPZA
DV7Up35Q_T4,,UgztkFXsrNg91k9SvHp4AaABAg,False,@15lnd,岩手県民ではないのですが、3月に盛岡に行ったのでどこで参政党が話をしているのかな？と思いました。自民は終わりですね。２万を配っても意味がない。減税してほしい。どれだけ国民が税金を払っているのか。私たちは税金のために働いているのではない！,2,2025-07-09T13:24:17Z,2025-07-09T13:24:17Z,UChUZBbWCOlirlMSbRMeNxHw
DV7Up35Q_T4,,UgzjftKJfTkrIFBiUsV4AaABAg,False,@らーゆ-k9i,盛岡駅前行きました❗本当に日本の為に日本人が変わらなければならない。目を覚まさなければならない。頑張れ参政党‼️行こうぜ及川さん‼️神谷代表。体調に気を付けて、この選挙乗り越えて下さい。応援しております。,4,2025-07-09T13:06:05Z,2025-07-09T13:06:05Z,UCnrAZAMfwIo9u4LWA3D5r9Q
DV7Up35Q_T4,,Ugx0sPZPfRxhkBMsPqh4AaABAg,False,@masa-bw2mg,岩手県に住んでます。今まで自民党一本やり…安倍晋三が居ない自民党はもういらない。日本国に必要ない。皆さんの子供、孫の為に考えて投票に行って下さい。,2,2025-07-09T12:24:15Z,2025-07-09T12:24:15Z,UCNjk9txxYXMNJSRK8I0wOXQ
DV7Up35Q_T4,,Ugwnx7exSG5S74XK2AJ4AaABAg,False,@toga4058,"暑い中岩手までお疲れ様です！
参政党に投票します！",6,2025-07-09T11:59:19Z,2025-07-09T11:59:50Z,UCW54y98eB_bHlEieaZxDr0A
DV7Up35Q_T4,,UgwO9dktVCDxwoNC8zd4AaABAg,False,@Hz59akj,"大声出してが鳴れば、いいってもんじゃ無い‼️
根拠も無く、人聞きが良い事を羅列して大声で吠えるエセ保守党首‼️
　信者の皆さん、今のうちに大いに盛り上がってちょーだい‼️
　そのうちに化けの皮が剥がれ恥ずかしくなると思う
まあ、これを見れば党首のヤバさが分かります😊

https://youtu.be/KKSkZjDi-FU?si=RSNJ0JGn7Zpfs8ux",1,2025-07-09T10:45:40Z,2025-07-09T10:45:40Z,UCLIl6PdXIs6vhCe2xQLX-BQ
DV7Up35Q_T4,,UgwGwb1TC5JjtXdcAqN4AaABAg,False,@masasuzu0024,"選挙に行こう‼
他党を離党し参政党から出馬する「川裕一郎」「梅村みずほ」を当選させよう‼
比例は政党名ではなく個人名で「川裕一郎」「梅村みずほ」と投票しましょう
https://www.youtube.com/watch?v=30zC6YPMSmo",2,2025-07-09T09:43:41Z,2025-07-09T09:43:41Z,UCmPt-bJJLUcm46CSERgYfYA
DV7Up35Q_T4,,UgyqadEGIE_9q9EMMtF4AaABAg,False,@kinmokusei6374,"医療や食べ物の事…
ずーっと心に想いながら公には言いにくかった事、今まで政治家が言ってくれなかった事を言ってくださりありがとうございます。
考えや想いに激しく共感です✨",2,2025-07-09T08:34:30Z,2025-07-09T08:34:30Z,UC30cLCTsyNOzaftOH0uWJOA
DV7Up35Q_T4,,UgxT14OF0Rtu_u8RH2V4AaABAg,False,@そら-w1r4b,"体調がよくなりますように😢
倒れず走り抜ける事を祈っています。",3,2025-07-09T05:01:30Z,2025-07-09T05:01:30Z,UCK_8EV5shCS2-ot0f7YIg_A
DV7Up35Q_T4,,UgykxcF_UuOWCUnKKw54AaABAg,False,@かこあり,"及川さんの熱い想い
伝わりました
自公政権に任していたら
岩手県民の
気持ちを考えずに
岩手も外国人だらけに
されてしまいます
何としても当選して
岩手を守ってください！",3,2025-07-09T04:30:08Z,2025-07-09T04:30:08Z,UCpm4i1rsWBdqULpXzmDVjfg
DV7Up35Q_T4,,Ugz-co4odjHlF7tzgDp4AaABAg,False,@yoshikazuf,鹿児島県民です。参政党　及川たいすけさんがんばれー‼応援しております。,11,2025-07-09T02:07:30Z,2025-07-09T02:07:30Z,UC8-1P-AiXtafr6t-sYuMzTw
DV7Up35Q_T4,,Ugx4Z0bBcrhaOyOasw54AaABAg,False,@くぅちゃん-p6n,及川たいすけさんですよ。名前を間違えると無効になってしまうのでくれぐれもご注意下さい。,3,2025-07-09T02:00:45Z,2025-07-09T02:00:45Z,UCPz33LqGRfhHUXY8oOo3Suw
DV7Up35Q_T4,,UgyTZ_2Kxycpt6jSAxl4AaABAg,False,@aoiro2769,"外国人が日本の土地を買って農業して「国産」で売ったりしそうで怖いので、食品表示法の見直しはとても大事だと思いました。
農業をやりたいと思える政策、安心して子供を産んで育てられる政策。
参政党と私達の投票で日本を変えて行きましょう✨",1,2025-07-09T01:50:23Z,2025-07-09T01:50:23Z,UCzbLk3SdpldWXdg3i85DLow
DV7Up35Q_T4,,UgxzUfJ1DI2AQuR1EWp4AaABAg,False,@santiti5893,"参政党の演説をほとんどアーカイブで見てるんだが、、
心に響くんだよ。

候補者も素晴らしいし、演説の言葉選びや政策や、何より想いが通じる。
YouTubeの、ライブ、って所で過去のアーカイブ見れます。",8,2025-07-09T01:38:22Z,2025-07-09T01:38:22Z,UCEaYjKXAxj2tnVZQP8GWaxg
DV7Up35Q_T4,,UgxY0FU0kAIYHifL2GB4AaABAg,False,@しししななな-w2m,"よくぞ出てくださいました。市民を代表して感謝を申し上げます、勇気を出して出てくださってありがとうございます。

仕事柄、東京へよく行きますがもうコンビニの店員はほぼ外国人です。恐怖を感じていました。

日本人を守りたいし、農業も守ってほしい。おじいちゃんおばあちゃん、そして子どもや孫、みんな日本人を守っていきましょう。


投票、いきましょう！！！！！",15,2025-07-09T00:40:21Z,2025-07-09T00:40:21Z,UCkZnTEIpxmXFVvrsAA7Zdbg
DV7Up35Q_T4,,UgwmP7Lrrl5-cg96H_N4AaABAg,False,@チョコバナナ-e3p,"https://youtu.be/9XwDe5SeoEs?si=20McJZxzGEm7YS9n
参政党最高😃",1,2025-07-08T23:12:19Z,2025-07-08T23:12:19Z,UCbAdvo9dTSb14gin1oNGgYQ
,UgwmP7Lrrl5-cg96H_N4AaABAg,UgwmP7Lrrl5-cg96H_N4AaABAg.AKKr4JYR-ziAKZF2ya2zlR,True,@Tz3952ii,"20件もアンチコメってけっこう執着してますね〜
ということはそのリンクもネガキャン動画のリンクなんでしょうね🤭",0,2025-07-14T13:19:58Z,2025-07-14T13:19:58Z,UCET8nQtGZcmFy_-XSYSM--w
DV7Up35Q_T4,,Ugy-J1WivRf-kwtgZId4AaABAg,False,@チョコバナナ-e3p,https://youtu.be/9XwDe5SeoEs?si=20McJZxzGEm7YS9n,0,2025-07-08T23:11:43Z,2025-07-08T23:11:43Z,UCbAdvo9dTSb14gin1oNGgYQ
DV7Up35Q_T4,,Ugxhg-2wPAAD5kfLYdx4AaABAg,False,@mori03020302,"岩手県民です。
参政党に入れますよ👍",37,2025-07-08T23:04:45Z,2025-07-08T23:04:45Z,UCd1S2QcoA0jvgc5qpt7GfDw
DV7Up35Q_T4,,UgybBPemxavNCAmSr214AaABAg,False,@KentaNakatsugawa,"政治の勉強かなりしてるな神谷さん🎉
すごい",10,2025-07-08T21:23:35Z,2025-07-08T21:23:35Z,UCMFGlYZaAU2Ml8jKUct8thw
DV7Up35Q_T4,,Ugyr4k4xsXOpu2cXK6F4AaABAg,False,@はなz7m,埼玉ではトルコ国旗掲げて選挙の邪魔されています。岩手も気をつけて下さい。頑張ろう日本！,3,2025-07-08T21:19:22Z,2025-07-08T21:19:22Z,UCmLxkXQPCiGL8rg9vHKy4vA
