videoId,parentId,commentId,isReply,authorDisplayName,text,likeCount,publishedAt,updatedAt,authorChannelId
lYDGyVzjjTA,,UgwQpbcLDBy1wSl8A0B4AaABAg,False,@さゆさゆ-z4m,"応援しています　大阪の母親にしっかり伝えたいと思っています　
日本誠真会、吉野じゅんこさんが立ち上がってくれたこと本当に有難いです。子供　若者の未来を守りたいです。日本誠真会の嘘をつかない　しっかり伝わっています　ありがとうございます！",13,2025-07-10T23:12:10Z,2025-07-10T23:12:10Z,UClWm-1sKDq2RMkw7N_uiSWA
lYDGyVzjjTA,,Ugx8Bnf85kD8UlJdqsR4AaABAg,False,@May-xe6qv,"じゅんこ先生！
立ち上がって下さったんですね😭
日本の為に、日本人の為にありがとうございます🙇‍♀",13,2025-07-10T19:46:23Z,2025-07-10T19:46:23Z,UCBHoPU5l8ksCldGBkHtAuCQ
lYDGyVzjjTA,,Ugxv9Ypp5Q5kuj0nh7V4AaABAg,False,@コケシママ,"本当に日本の為にありがとうございます😭
吉野じゅんこさんに1票を入れないとダメになるよ！",13,2025-07-10T15:09:44Z,2025-07-10T15:09:44Z,UCpFtHX5OYU3QdPBsf09PKlQ
lYDGyVzjjTA,,Ugz7Yew3MIdH3Un-P2l4AaABAg,False,@GOTTk10,今回は迷わず気持ちいれて(日本誠真会),13,2025-07-10T13:15:35Z,2025-07-10T13:15:35Z,UCtKTMxuLxZ5ff2QVtTbxY6g
lYDGyVzjjTA,,UgwiX4m_kPU9IQsPoG94AaABAg,False,@eこちゃん,じゅんこ先生素晴らしい政権放送です。感激しました。是非当選して下さい。お祈りしています。,16,2025-07-10T06:21:56Z,2025-07-10T06:21:56Z,UCa6MeDp0-ykHl0Rd98H4fcw
lYDGyVzjjTA,,Ugx2Qblqu5BQyJmlzJJ4AaABAg,False,@desktopfactory7878,"日本誠真会を全力応援しています‼️

大阪から立候補頂き、ありがとうございます‼️

吉野じゅんこさんで迷いなく一択💪

大阪の皆さん、吉野じゅんこさんを、日本誠真会を国会に送りましょう‼️
お力添えをお願いいたします🙇",16,2025-07-10T03:02:06Z,2025-07-10T03:02:06Z,UCk9GG4K4GPD0Z97Aafw2iFw
lYDGyVzjjTA,,Ugx1QumpXCFK8OBISRJ4AaABAg,False,@みゆ-p3m9z,じゅんこさんꫂ ၴႅၴ‪*.𝝑𝝔応援してます！ありがとうございます！,8,2025-07-10T00:58:45Z,2025-07-10T00:58:45Z,UCFDsqVgTs57nbGDi_gNMgGQ
lYDGyVzjjTA,,Ugx2xAnHejP2o3ZKh954AaABAg,False,@nishipuro,騙されてはいけない。流されてはいけない。,8,2025-07-09T16:09:00Z,2025-07-09T16:09:00Z,UC4w3FeLp9DT0p9v0hBc2wdQ
lYDGyVzjjTA,,Ugx9T1KeGjuXm-0K3LF4AaABAg,False,@rurerorari,吉野じゅんこさん❗️素晴らしい✨ありがとうございます😊,21,2025-07-09T03:57:06Z,2025-07-09T03:57:06Z,UCKTtKm_UcIYy78hObW7xtFQ
lYDGyVzjjTA,,UgwS7Cs1grhvdT05bHp4AaABAg,False,@mimimim2525,大阪の皆さん、全員に観ていただきたい！！,16,2025-07-09T03:24:00Z,2025-07-09T03:24:00Z,UCxYED-cZpt18P-7A7xjTDUA
lYDGyVzjjTA,,UgwtBTisyEciyRJxRel4AaABAg,False,@タバコ888,戦争反対‼️改憲反対‼️,6,2025-07-08T20:07:07Z,2025-07-08T20:07:07Z,UCM0vwF8Q9F4XER7OPWLYAkw
lYDGyVzjjTA,,Ugwpt0oO7ArPPd9dntx4AaABAg,False,@大葉の,"🔴日本誠真会🇯🇵✨🔴
〜誠意と真実と敬い〜
日本を元に戻す‼︎
日本の病を治す‼︎
日本誠真会を国政政党へ✨
吉野としあきを総理大臣へ‼️
🔻🔻🔻🔻🔻🔻🔻🔻🔻🔻
大阪府民の皆さま、
選挙区【吉野じゅんこ】
全国比例は【日本誠真会】
　　または【吉野としあき】
🔺🔺🔺🔺🔺🔺🔺🔺🔺🔺
とご記入宜しくお願い致します✨",2,2025-07-08T16:34:08Z,2025-07-08T16:34:08Z,UCj4VrqZAiavTunaovWMNVew
lYDGyVzjjTA,,UgzUR8XrRtnp59oqmVl4AaABAg,False,@yururi2992,よしりんは命懸けなのでよめりんも大変❕❕頑張れ❕❕,15,2025-07-08T15:24:57Z,2025-07-08T15:24:57Z,UCcb0O6TMP0UHugixuAym_XA
lYDGyVzjjTA,,Ugy6ZwvV8xF2h1XyWdF4AaABAg,False,@nbktnk2991,"大切なことが５分にギュッとつまった、よくわかる政見放送です！吉野じゅんこさん、応援しています。
＃日本誠真会",22,2025-07-08T14:47:59Z,2025-07-08T14:47:59Z,UCqzm785kjwDww87cJxtlYPg
lYDGyVzjjTA,,Ugz7yEukIBudGHof-tR4AaABAg,False,@ptankob8235,"素晴らしい‼️素晴らしい‼️素晴らしい‼️ 
しっかりとした口調で毅然と立ち向かい、日本の病を治し、ボロボロになった日本を立て直していく覚悟が感じられました‼️",27,2025-07-08T14:37:10Z,2025-07-08T14:37:10Z,UC8iKo5AUurtPyc68BQt3mzQ
lYDGyVzjjTA,,Ugw3X0VJYLjudJJeIA94AaABAg,False,@愛犬と私と愛犬と,吉野じゅんこ先生、応援してます‼︎,29,2025-07-08T13:45:13Z,2025-07-08T13:45:13Z,UCla1M-QC46DVkr-5DovfIVw
lYDGyVzjjTA,,Ugw_vARando_uAjnZTl4AaABAg,False,@水攻め饅頭,吉野じゅんこと投票用紙に書きましょう。宜しくお願い致します。日本誠真会と投票用紙に書きましょう。宜しくお願い致します。,25,2025-07-08T13:22:04Z,2025-07-08T13:22:04Z,UCKWka0w3rB14UzUMKy22xfA
lYDGyVzjjTA,,UgwPUh2QwpM_EDTiHPh4AaABAg,False,@MasK-lb1yd,"すんごく気持ちが込められていて熱い演説だと思います！
当選を祈ってます😉",41,2025-07-08T13:10:39Z,2025-07-08T13:10:39Z,UCbGOAEGEqpjCLQbdeO4-LFQ
lYDGyVzjjTA,,UgwpcbAuxfK5J8jDfNp4AaABAg,False,@shちゅら,吉野じゅんこ先生！応援しております。是非国政で頑張って頂きたいです。,44,2025-07-08T12:44:27Z,2025-07-08T12:44:27Z,UC37Fcssj9EBfCYxXYQ7wscg
lYDGyVzjjTA,,UgwWi5nK3ha0GoP4nG54AaABAg,False,@ちょび-n1d,私は吉野ご夫妻と同年代です。吉野ご夫妻が諦めない限り、私も吉野ご夫妻の応援を諦めません!,44,2025-07-08T11:22:32Z,2025-07-08T11:22:32Z,UC5syDP-lPSXdOgPZLbP_B_A
,UgwWi5nK3ha0GoP4nG54AaABAg,UgwWi5nK3ha0GoP4nG54AaABAg.AKJ_qenv-paAKLLvOUOafD,True,@よっち-q6r,私も諦めない😊,2,2025-07-09T03:50:35Z,2025-07-09T03:50:35Z,UCOdlZdGKTp-gmt7oIsH0Wyw
lYDGyVzjjTA,,UgyO1DdGz5Vhb57pxPl4AaABAg,False,@美島康子-e5u,"じゅんこさん、広島生まれだったんですね。
私も広島生まれの広島育ち、親近感増しました。
当選お祈りしています❤❤❤❤❤❤❤❤❤❤",41,2025-07-08T10:12:52Z,2025-07-08T10:12:52Z,UCokqM2DXU5vfTcBdv5YTx-A
lYDGyVzjjTA,,UgzWXgDIYqPvTM0f42t4AaABAg,False,@TsubasaThreemiles,左後ろに見えるのはウサワの座敷わらしなのかな？ついにワシも霊能者になったのか😮❓️💦,9,2025-07-08T07:39:53Z,2025-07-08T07:39:53Z,UCwA1mXLZgH7PMEArywE6AUg
lYDGyVzjjTA,,UgxDC6pnufiqfH43itF4AaABAg,False,@TsubasaThreemiles,"広島生まれでその後高知(四万十?)なのか？ワシを前後で挟んで生まれ育ったのね🍊？
根本的に悪いところを治さないとね😊",2,2025-07-08T07:38:18Z,2025-07-08T07:38:18Z,UCwA1mXLZgH7PMEArywE6AUg
lYDGyVzjjTA,,UgwkWXhrpivIVLVWL2R4AaABAg,False,@よっちゃん-t9i,大阪の皆様、吉野じゅんこ先生を議員に押し上げて下さい!お願い致します。日本誠真会をよろしくお願い致します🎉,67,2025-07-08T07:36:59Z,2025-07-08T07:36:59Z,UC-L6CV9XYbqZS7cn1ar-Sog
lYDGyVzjjTA,,UgxRqXhLAewrgZMi0WF4AaABAg,False,@真田H-y1x,"絶対に諦めない、絶対に嘘をつかない、国民を愛する日本誠真会！
選挙区は「吉野じゅんこ」比例は「吉野としあき」一択です！！",48,2025-07-08T06:55:44Z,2025-07-08T06:55:44Z,UCKxPwfMdMeRcY1Lp8OhDHVg
lYDGyVzjjTA,,UgxRxH1mOhoSAmWZ5CV4AaABAg,False,@manfuri5868,"吉野敏明を総理大臣に 
#自民党が滅びなければ日本が滅ぶ 
#日本誠真会は嘘つかない
 #日本の病を治す 
#税は税源じゃない",4,2025-07-08T05:50:11Z,2025-07-08T05:50:11Z,UCqcyIUFgsjVi5CufZ3iYGlA
lYDGyVzjjTA,,UgyMmFpfHmh4gfMSiLV4AaABAg,False,@6250kitty,吉野じゅんこさん　理路整然　滑舌　間もよく素晴らしい政見放送です!　有り難うございます。,70,2025-07-08T05:43:24Z,2025-07-08T05:43:24Z,UCr0HsFNH2oudU93Ckm8W1hg
lYDGyVzjjTA,,UgzXAYOIWGGan-WFCD94AaABAg,False,@元髭-j1b,力強く頼もしい‼️応援しています‼️,66,2025-07-08T05:24:33Z,2025-07-08T05:24:33Z,UCJCTBU5bo9ii4Z9qEQRac0w
lYDGyVzjjTA,,UgwDyW4QonqPETZV0pt4AaABAg,False,@Bs-xg2sj,選挙行こう,55,2025-07-08T05:16:36Z,2025-07-08T05:16:36Z,UCIEHXEjkgEzDueu2eGd_9ZQ
lYDGyVzjjTA,,UgyWh84fex4TUu4ojUh4AaABAg,False,@mii-rf9jg,"配信ありがとうございます。
じゅんこ先生を全力でお守りします！必ず日本を取り戻しましょう！",63,2025-07-08T03:56:33Z,2025-07-08T03:56:33Z,UCgkyyXIFOhqRtdoupQUZ2pw
lYDGyVzjjTA,,UgzLe0ChBdMeU-aWYSZ4AaABAg,False,@メグリン-q9q,"税を何かと財源にしたい政府。医療費を削減するにはどうしたら良いか、よしりん夫妻から学んで実行してください。対処療法ばかりじゃ改善なんかあったもんじゃ無い。国民の稼いだお金を自由に使うなと言いたい。
日本誠真会、比例しか応援出来ないけど選挙区も
吉野としあきと書きます。",4,2025-07-08T02:40:25Z,2025-07-08T02:40:25Z,UCu4uK02JXj9DaZJ1TfmhrVg
lYDGyVzjjTA,,UgxPy2yyp3nf0XEbGJF4AaABAg,False,@メグリン-q9q,手話、ありがとうございます。,52,2025-07-08T02:29:30Z,2025-07-08T02:29:30Z,UCu4uK02JXj9DaZJ1TfmhrVg
lYDGyVzjjTA,,UgwrsgN-KsqxdOcIVvN4AaABAg,False,@山本尚子-r3t,吉野じゅんこ🎉,54,2025-07-08T00:44:36Z,2025-07-08T00:44:36Z,UCr6tN9KRkYPdB-VUNLXrxBQ
lYDGyVzjjTA,,Ugw_mrKvYO357J2C6bV4AaABAg,False,@classefunpopora80,じゅんこ先生の訴えとても素晴らしかった👏✨👏✨👏皆で日本を元に戻しましょう↗↗↗,87,2025-07-08T00:06:35Z,2025-07-08T00:06:35Z,UC1txVNas-9hyFjIS_yRI5ZA
,Ugw_mrKvYO357J2C6bV4AaABAg,Ugw_mrKvYO357J2C6bV4AaABAg.AKINUvFx5WRAKJBbBHfPHO,True,@TsubasaThreemiles,さらに良くしよう😂,13,2025-07-08T07:41:58Z,2025-07-08T07:41:58Z,UCwA1mXLZgH7PMEArywE6AUg
lYDGyVzjjTA,,UgxEIT198-Cu-8jclGJ4AaABAg,False,@カラスゆうやけ-h9q,バシッと言ってくれました‼️,61,2025-07-07T23:37:15Z,2025-07-07T23:37:15Z,UCJf8Kpe5Sak97vRlwEmARHA
lYDGyVzjjTA,,UgwQHZ30oGn7WdFX5iJ4AaABAg,False,@titonsama,吉野じゅんこさん！素晴らしい演説をありがとうございます！,73,2025-07-07T23:16:52Z,2025-07-07T23:16:52Z,UCD6rYhFIre9axVIfmtZC2eg
lYDGyVzjjTA,,UgzzqdO77pV7WeUr3gp4AaABAg,False,@sakiko.k9016,じゅんこ先生、必ず国政に出て下さい。頑張って下さい！応援してます！,104,2025-07-07T23:15:44Z,2025-07-07T23:15:44Z,UCXtbvPT3z5T9Uv473oAqUww
lYDGyVzjjTA,,UgzMteCoutDSCVDQfn94AaABAg,False,@ミスターオカピ,ハシモト氏早くよしりんを名誉毀損で訴えて裁判で戦いましょう。これだけ維新の会をコケにされて黙っている気ですか？逃げ切る気ですか？弁明責任をとってください。それが出来ないなら中華、志那に、家族でお逃げください。よろしくお願いします😊,48,2025-07-07T23:06:47Z,2025-07-07T23:06:47Z,UCF2HAHracDjv2NJ6tgaXorQ
,UgzMteCoutDSCVDQfn94AaABAg,UgzMteCoutDSCVDQfn94AaABAg.AKIGdv6gRpiAKJBtAEzCJ0,True,@TsubasaThreemiles,これこれ子どもはそんなには罪無いよ、下手に渡って用無しなったら危ないよ😢,1,2025-07-08T07:44:25Z,2025-07-08T07:44:25Z,UCwA1mXLZgH7PMEArywE6AUg
lYDGyVzjjTA,,UgybIoWrm0fCCJblnFR4AaABAg,False,@スミスミ8,よめりん😊😊,61,2025-07-07T22:55:39Z,2025-07-07T22:55:39Z,UCRvy6noODdaY4g5RY68EbrQ
lYDGyVzjjTA,,UgxJk6ido2jBt-e_UyB4AaABAg,False,@たるぽん11,吉野敏明セレクトチャンネルさん、初めまして、ごきげんよう☀よめりんこと吉野じゅんこさんの政権放送を配信してくてありがとうございます🎶観れてとっても嬉しかったです😊よめりん応援してます🤗,80,2025-07-07T22:21:25Z,2025-07-07T22:21:25Z,UCNuz_epbdFg_Lw9dMV29v1Q
lYDGyVzjjTA,,UgyA_MKXTs3wA_vbCJR4AaABAg,False,@アンジュ-p4w,吉野じゅんこ先生の政見放送しっかり伝わりました。頑張ってください。ありがとうございました❤,86,2025-07-07T22:16:50Z,2025-07-07T22:16:50Z,UCmXjExvuqYaFviGfRRpWp6A
,UgyA_MKXTs3wA_vbCJR4AaABAg,UgyA_MKXTs3wA_vbCJR4AaABAg.AKIAvytuwCUAKISFHA6a_W,True,@山本尚子-r3t,維新排除するのは、私達,11,2025-07-08T00:48:09Z,2025-07-08T00:48:09Z,UCr6tN9KRkYPdB-VUNLXrxBQ
lYDGyVzjjTA,,UgytHUWcd-9MtNKUt2Z4AaABAg,False,@モモ-v4k,バッチグー!!  的確でよくわかるお話です!!,74,2025-07-07T22:06:17Z,2025-07-07T22:06:17Z,UCYCpU3jroRGk30brUZjhoaA
,UgytHUWcd-9MtNKUt2Z4AaABAg,UgytHUWcd-9MtNKUt2Z4AaABAg.AKI9igsmraRAKISB2KruVx,True,@山本尚子-r3t,👍維新最悪,0,2025-07-08T00:47:34Z,2025-07-08T00:47:34Z,UCr6tN9KRkYPdB-VUNLXrxBQ
lYDGyVzjjTA,,Ugy4gHcW_4Uv4TceFqV4AaABAg,False,@365diary2,吉野じゅんこ先生、どうか国会議員になってください🙇‍♀️ どんどん飛躍してください。日本に本当に必要な方！！絶対当選🎉🎉🎉🎉,129,2025-07-07T20:40:58Z,2025-07-07T20:40:58Z,UCC1ksYeknAd6tX4jWQwOjaQ
,Ugy4gHcW_4Uv4TceFqV4AaABAg,Ugy4gHcW_4Uv4TceFqV4AaABAg.AKI-xpPTR75AKIS4p0GWfY,True,@山本尚子-r3t,大阪から維新排除,1,2025-07-08T00:46:43Z,2025-07-08T00:46:43Z,UCr6tN9KRkYPdB-VUNLXrxBQ
lYDGyVzjjTA,,UgxwdbG9gXwBn2wNBfx4AaABAg,False,@金澤周一-r3j,よめりん。おうえんしてます。がんばってください。ありがとうございます。❤😊🎉,101,2025-07-07T20:15:38Z,2025-07-07T20:15:38Z,UCJladrSNmY4pqp7l2deR7yA
lYDGyVzjjTA,,Ugztxxyso9-dsHMwi8B4AaABAg,False,@tarkun0422,"頑張るんば💪
とりあえず比例で6票確保~~~
比例で2人は行ける予想(๑•̀ㅂ•́)و✧",71,2025-07-07T18:10:59Z,2025-07-07T18:12:00Z,UCcRTMPwbjgAoCOQbzAvBIPQ
gIe1XgmXsQQ,,UgwsAB2_aZi4Vx5yzlB4AaABAg,False,@kato246,チゃう・ちゃう・負ける選挙,0,2025-07-14T09:42:04Z,2025-07-14T09:42:04Z,UCh9iw4SCFyxRogQdQa3siWg
gIe1XgmXsQQ,,Ugz0eXZl6s0jEqNK3Vp4AaABAg,False,@つす-z7d,"岸田あたりから利権を堂々と求め理念無視な売国政策しまくってたからね。
とにかく経済成長させない為に増税したんでしょ。
昔から利権大好きだったけど、最近はいくらなんでも正々堂々売国しすぎ。
ついには完全売国石破首相を誕生させた時点で自爆でしょ。
いくらなんでも勝てるはず無いよね。",0,2025-07-10T13:52:21Z,2025-07-10T13:52:21Z,UCx5vqsjGmUgDRmazzOA3ixg
gIe1XgmXsQQ,,UgzWNsFi4pqiLsd-QzN4AaABAg,False,@KANA-n4g,負けないといけない選挙です。いつまでも好き勝手出来ると思うな,0,2025-07-10T11:59:46Z,2025-07-10T11:59:46Z,UCP2joqflcc8OvZ7wmc0RbLQ
gIe1XgmXsQQ,,UgzjpnBgimSgCvJZDWB4AaABAg,False,@羽林-x4g,「国民が自民党の圧政に負けてはならない選挙だ、と思っております。自民党が政権を持っているのが国難です。何としても自民党を潰ぶそう。」,0,2025-07-10T03:50:54Z,2025-07-10T03:54:16Z,UC5oFwgrrhNeg0Q8lrwOSO_A
gIe1XgmXsQQ,,Ugzmgj5wQcjgok70UNV4AaABAg,False,@9552-v3x,負けてもええんやで、骨は拾ってやるけぇ,0,2025-07-09T22:54:51Z,2025-07-10T05:48:51Z,UCBxeP75jOsN03piaNSvUgsw
gIe1XgmXsQQ,,UgyAj8A_8nSBcKjwtXV4AaABAg,False,@ベータま工房,"このジジイ、認知症診断してもらった方が良いのでは？
国難作っているのが自分たちという認識が無いのはなぜなのか。自公政権が国難というしかない。
これが高市氏であったとしてもお茶を濁す政策しか打てない。期待外れと言われるだけ。
安倍さんが殺されるようなレベルまで政府自民党が毒されているのだから。",0,2025-07-09T17:55:36Z,2025-07-09T17:55:36Z,UCfZcp_Hvlcgc0D9p2eUEuPQ
gIe1XgmXsQQ,,Ugxman30faM4sUOAZF14AaABAg,False,@タチウ男,自民党にはもう懲り懲りなんだよwww,0,2025-07-09T15:27:36Z,2025-07-09T15:27:36Z,UC2n3X8BzjF8VXotzGmOzGeA
gIe1XgmXsQQ,,Ugxi7V6wwfYDTFbQezh4AaABAg,False,@ヒロヒロ-q2m,おい自民党がこの３０年何して来た？今の現実を見ろ,1,2025-07-09T11:45:28Z,2025-07-09T11:45:28Z,UCd17o91upqnrubNTAfpHsLA
gIe1XgmXsQQ,,UgxIRxNhmrWZkGfBXoF4AaABAg,False,@aつかさん,老害は早く隠居してくれ,0,2025-07-09T10:45:43Z,2025-07-09T10:46:07Z,UC9mcT3nHT2_XP6PCzwTtU4Q
gIe1XgmXsQQ,,Ugw6yrCGll0FhW-ib514AaABAg,False,@サギノミヤ-o9j,なくなれよ自民党,0,2025-07-09T08:19:36Z,2025-07-09T08:19:36Z,UCyz0AIxCa1fhQep6z1EQhwg
gIe1XgmXsQQ,,Ugz8Ql2no0gnq4VIlOJ4AaABAg,False,@治砂塚,それなら何故真摯に,0,2025-07-09T06:39:51Z,2025-07-09T06:39:51Z,UCR5ClE1woGDy74nEbIgw1Tg
gIe1XgmXsQQ,,Ugx76KaTjd_BUngtjed4AaABAg,False,@らいちゃん-h9e,80歳でもまだ権力って必要なの？もう化け物みたいになってるのかな。,0,2025-07-09T01:55:55Z,2025-07-09T01:55:55Z,UCuoeggCO8_wXJrbwOqIPHFQ
gIe1XgmXsQQ,,UgwMQdlxNCWnn84GO2V4AaABAg,False,@P-ju7eu,"森山
「(利権と面子の為に)自民党が負けてはならない！(ｷﾘｯ)」",0,2025-07-09T00:19:50Z,2025-07-09T00:19:50Z,UCdiprL_Zyu13DoTLNRWZt2A
gIe1XgmXsQQ,,UgxGj4kxhTXjU5Z37xt4AaABAg,False,@K.Sasaki-u1f,消費税(付加価値税)廃止！[米国と同じ]小売売上税(地方税、預り金、インボイス不要(無意味))導入で歳入は同じ！食料品、生活必需品は減税！財源は、輸出還付金で！,0,2025-07-08T23:11:42Z,2025-07-08T23:11:42Z,UC1UDoTv3urE3Bw3FyfWZvMQ
gIe1XgmXsQQ,,UgxKlI0lxH2hz2vvP2d4AaABAg,False,@htnk120630,"鹿児島選挙区は尾辻議員の娘が優勢らしい
自民党推薦を断られて立憲推薦の2世候補？
さすが幹事長のお膝元",0,2025-07-08T21:51:11Z,2025-07-08T21:51:11Z,UCjMS79QJjAZU0Y9ultfKerQ
gIe1XgmXsQQ,,UgwHayFhU7Lh8KxF5Dd4AaABAg,False,@udai7398,お前が辞めたら少しはマシになるだろう,0,2025-07-08T20:38:25Z,2025-07-08T20:38:25Z,UC2VMMmZUFMfRSbp0Nvm8Uaw
gIe1XgmXsQQ,,Ugz6yp5m3m_1rIfBmF94AaABAg,False,@通りすがりの人-k7r,自民党を消さなければダメなのはよ〜くわかった。,0,2025-07-08T14:45:23Z,2025-07-08T14:45:23Z,UCR_135cJTusJj-BeCWxCtAw
gIe1XgmXsQQ,,Ugz_H-ZOd5NTYDJfm1p4AaABAg,False,@三上-j7c,"さんざん日本をダメにして、頭大丈夫か
自分とお仲間どもの、既得権益にしがみ付きたいだけ
選挙が通り過ぎたら公約なんて知らんが目に浮かぶよ",0,2025-07-08T14:17:02Z,2025-07-08T14:17:02Z,UCJGsrrisJcxRYV41lCldy_Q
gIe1XgmXsQQ,,UgyDBSw9QFv0RgKSgRd4AaABAg,False,@ab7657C1,自公に投票する非国民はだれ？,0,2025-07-08T13:57:12Z,2025-07-08T13:57:12Z,UCBRS0fDmJTChTHLmfM-bvRg
gIe1XgmXsQQ,,UgxW3dkh5zaRYznCKjt4AaABAg,False,@筧十五,自民党を消さないといけない選挙。,0,2025-07-08T13:38:05Z,2025-07-08T13:38:05Z,UCIUdAbJ6PCX9LDAqPMiAaJQ
gIe1XgmXsQQ,,UgyoazOA3rdbBTyq0H54AaABAg,False,@なまごみのかまたり,"もうさっさと変われよ
30年も続いた自民以外が政権とったらどの道日本は混乱するに決まってる。でもあんたらが続けるよりは遥かにマシな未来しか想像できない",0,2025-07-08T13:01:22Z,2025-07-08T13:01:22Z,UCfGNdLnkXRhMTa6aV-eu5SA
gIe1XgmXsQQ,,Ugw_q4P2D4oQIh3sjyh4AaABAg,False,@議員と公務員を削減,参院選は、自民党が負けなければならない選挙だ。,0,2025-07-08T12:53:55Z,2025-07-08T12:53:55Z,UCPV2rMAsfob-NEGRe9htj9A
gIe1XgmXsQQ,,UgwPxLkk-PeDrBYLx8l4AaABAg,False,@kerokero-harusame,極左の人たちが負けられない戦いというのと同じレベルで民意を反映していない,0,2025-07-08T12:39:33Z,2025-07-08T12:39:33Z,UCWzV6YQrHM2eOkd_4VXoE5Q
gIe1XgmXsQQ,,UgwJZ2Aeb1OsZq9uSY14AaABAg,False,@e2004,本当にそう思うなら、幹部連中全員入れ替えすればいいじゃん。それはできないんでしょ？なら自民が勝つより、自分が大切ってことだ,0,2025-07-08T12:02:12Z,2025-07-08T12:02:12Z,UCmFyBLKHIWa94feSEPOd8jg
gIe1XgmXsQQ,,UgxbYEmT-otdJTzRLct4AaABAg,False,@ダイソンミックス,負けなきゃならない選挙だぞ,0,2025-07-08T11:44:46Z,2025-07-08T11:44:46Z,UCt-J3D0nkdod4glv3tC4rOA
gIe1XgmXsQQ,,UgzvDWTeiH0iK6dgagV4AaABAg,False,@akira-pd1jl,いよいよ、王茂を政界いや日本から追放するきっかけとなる参議院選挙だ！！,0,2025-07-08T11:31:21Z,2025-07-08T11:31:21Z,UCvDoMs2OaahCnoDWDRnWC8g
gIe1XgmXsQQ,,Ugz0anpgtn-iJonrZaV4AaABAg,False,@佐野克弥,ニコ動の討論会で参政党の神谷代表の国防意識が素人レベルって事が分かった。これじゃ政権を任せられんとは思う。ただ、立憲に代わって野党第一党として自民を常に突き上げる存在になってほしいかな。,0,2025-07-08T10:35:20Z,2025-07-08T10:35:20Z,UC5Rx3hRjdNB61KDo-jfGrwg
gIe1XgmXsQQ,,UgykWpU5RpoNdtbWNbt4AaABAg,False,@hh.5225,この方は「政治家生命をかけて」とか「負けられない」とか言うけど誰の為になのか。,0,2025-07-08T10:30:41Z,2025-07-08T10:30:41Z,UCaJODayhRuf9JF1hXxOlKcw
gIe1XgmXsQQ,,Ugw7qdYnMUBbwCnY3vJ4AaABAg,False,@チキンフィレオ-z7f,というより森山は馬鹿なのか⁉️😂負けられない選挙とかゆーてるけど去年の衆議院選挙過半数届かんくて惨敗したやんけ😂都合の悪いことはすぐ忘れるんか⁉️それとももうボケが始まったわけ？😂,0,2025-07-08T10:24:35Z,2025-07-08T10:24:35Z,UCGCnSfh6qdqomhg2LotvjRQ
gIe1XgmXsQQ,,Ugw9eE6mRDymA2x9lJx4AaABAg,False,@チキンフィレオ-z7f,既得権益守るために必死やな😂石破や岩屋もそやけど森山も恥が服着て生きてるようなもんやん😂,0,2025-07-08T10:19:03Z,2025-07-08T10:19:03Z,UCGCnSfh6qdqomhg2LotvjRQ
gIe1XgmXsQQ,,UgyETM4MnsbeegeT4w54AaABAg,False,@ふるさわじゅん,"違うよ！自民党を完膚なきまでに叩きのめさないとならない選挙です！
いつも自民党だけどどうしようかな…って人！よーく考えて下さいね！日本が日本でなくなるんですよ？自分の子孫が某国の人間に奴隷の様に扱われる様になるんですよ？この30年間良いなっていってますか？衰退の一途じゃないですか？",0,2025-07-08T10:15:26Z,2025-07-08T10:15:26Z,UC8sCZjiZR0lh883D25fC9mg
gIe1XgmXsQQ,,UgxnOwU6v55_3e92i2N4AaABAg,False,@ヒロユキ-o1x,自民公明を潰す為に国民は今頑張ってるのですが？,0,2025-07-08T10:02:41Z,2025-07-08T10:02:41Z,UC_lNOnKN1AU6cHeU2ia4noA
gIe1XgmXsQQ,,UgzvqnbB8JnpoSugLaV4AaABAg,False,@isotasadawas,すでに2度惨敗してるんだけど🤣,0,2025-07-08T09:52:26Z,2025-07-08T09:52:26Z,UCwybI-9XfBhHGGlCLzyYHXw
,UgzvqnbB8JnpoSugLaV4AaABAg,UgzvqnbB8JnpoSugLaV4AaABAg.AKJQXkaZhCiAKJUJJ2qJfb,True,@チキンフィレオ-z7f,そうですよね😅都議選と去年の衆議院選挙過半数取れずで😁,0,2025-07-08T10:25:25Z,2025-07-08T10:25:25Z,UCGCnSfh6qdqomhg2LotvjRQ
gIe1XgmXsQQ,,UgziRwsB7muk8_k0uy14AaABAg,False,@ruruburita4525,"また言うか😠💢
政治と選挙を分けんな😠",0,2025-07-08T09:46:02Z,2025-07-08T09:46:02Z,UCCDoxgWO2QFeuMSt0FCxybQ
gIe1XgmXsQQ,,Ugz-iaI05wOI_UCwetV4AaABAg,False,@あったかい-k2k,早く負けた責任で引退してくれ,0,2025-07-08T09:31:08Z,2025-07-08T09:31:08Z,UCzXLWDqdMLfBZzKWjL1CS2Q
gIe1XgmXsQQ,,UgwkKdJBTDqDiZ-Jchd4AaABAg,False,@ryonari7919,"国の行方じゃなく、自分たちの利権や発言力しか見てない政党には投票しません
国の行方を憂いて、しっかりした政策の為に発言力を欲している政党へ投票します",0,2025-07-08T08:39:12Z,2025-07-08T08:39:12Z,UCkyBt1tBEXocr_pVnZVSxQw
gIe1XgmXsQQ,,Ugxys_CZoBzuipwjS_V4AaABAg,False,@satoshiy8823,やかましいわ,0,2025-07-08T08:39:09Z,2025-07-08T08:39:09Z,UCH_WseF3ZxBTsZUxfRt34AQ
gIe1XgmXsQQ,,UgwjquoH5li_FOA5-6Z4AaABAg,False,@ちょちゃん-b3g,コイツ…在日？日本人ぢゃないんじゃない？,1,2025-07-08T08:30:12Z,2025-07-08T08:30:12Z,UCTQYkqjGmyJ8rElOtHIpX6A
gIe1XgmXsQQ,,Ugzx0W-sDmxvx9n1XhJ4AaABAg,False,@sagaichigo,"せやな。先日の、ガソリン暫定税廃止法案を参院でナメたことした件で
選挙結果がでたら連休明けで速攻でリベンジしてきそうだもんね！",0,2025-07-08T08:28:33Z,2025-07-08T08:28:33Z,UCIsP0OYknYIUi49Keu6-mRA
gIe1XgmXsQQ,,UgxU9HiZvB_qAdgwpop4AaABAg,False,@user-ov3fj3yy6i,森山幹事長は衆議院議員だが、参院選で自民党は惨敗するので自民党とともに心中して下さい。,0,2025-07-08T08:26:25Z,2025-07-08T08:26:25Z,UCYhPd1aGfGHRAplusAuQpaA
gIe1XgmXsQQ,,Ugy64VcoHA05vLjaXyZ4AaABAg,False,@tukihimeneko,"利権まみれ奴らが、今更何を言っても誰も見向きもしないわ。
世が世なら、今頃そこら辺に転がってるぞ。
良い時代だな。",0,2025-07-08T08:13:07Z,2025-07-08T08:13:07Z,UCYxwp2_WNx3l9wmoO_ef1Ww
gIe1XgmXsQQ,,UgzKfk_uxL2r1cF7EjN4AaABAg,False,@永遠のオベラーツ,バァカ、この選挙は自民党が消滅しなければならない選挙だ！,0,2025-07-08T08:00:08Z,2025-07-08T08:00:08Z,UCk6ZmgDnH9WqR_cjcND0xfA
gIe1XgmXsQQ,,UgykfawODsiOQHEDIe54AaABAg,False,@山田一郎-g4l,"自民党不信任の原因の一人が…
もしかして笑うところですか?",0,2025-07-08T07:58:38Z,2025-07-08T08:00:10Z,UCwign-2Q5sBJa0M3hXtWMEQ
gIe1XgmXsQQ,,UgwFzXiSFb9jMm9niAl4AaABAg,False,@ノラゾウ,お前ら定年せんから終わるんや,0,2025-07-08T07:44:29Z,2025-07-08T07:44:29Z,UCE47z6MU8MrL0_AtnQGONfQ
gIe1XgmXsQQ,,Ugx4bii0-HhtS0rsbVh4AaABAg,False,@jマイク,鈴木大地もクビだわ,0,2025-07-08T07:39:35Z,2025-07-08T07:39:35Z,UCloCm2Zvjr5P7-xiHunzIOA
gIe1XgmXsQQ,,Ugy3tOlYY8yuq-rmAPR4AaABAg,False,@彗星-f9q,自公政権が終わらないと生活が苦しいです,2,2025-07-08T07:34:24Z,2025-07-08T07:34:24Z,UC3zS-Lwr_yisyfKsp1WdcBg
